risk_title,risk_summary,severity,direction,evidence_quote,realized_risk_id,PROJ_ID_IB,doc_type,doc_date
Security situation delays project implementation in southern Lebanon,"Unstable security conditions in Nabatieh and Tyre service zones are impacting data collection and project activities, requiring shift to virtual meetings and remote tools to mitigate risks.",high,persistent,"Given the unstable security situation in Nabatieh and Tyre, the mission recommended that data collection efforts are based on virtual meetings and remote tools where possible to mitigate security risks and ensure continuity of the work.",f21ed5fe,P176635,Aide Memoire,2025-07-03T12:35:03.000Z
Component 2 implementation jeopardized by security escalation,"Security situation escalation in Lebanon has caused slippage in Component 2 implementation, potentially jeopardizing project development objectives. Activities were previously put on hold due to security concerns.",high,persistent,"Component 2 observed a slippage in implementation due to the security situation, its implementation may be jeopardizing the project development objectives.",3f8631fb,P176635,Aide Memoire,2025-07-03T12:35:03.000Z
Stakeholder opposition and threats to Srar Sanitary Landfill project,A landowner's brother operating an adjacent open dump has filed a grievance opposing the Srar SLF and is threatening to damage the facility if not included in the project. This requires resolution before civil works can commence.,high,new,"The complainant opposes the SLF because is operates an open dump landfill on the adjacent land plot. He is insisting to be included in the project as well, otherwise he is threatening he will damage the SLF supported by the project.",4b78cf70,P176635,Aide Memoire,2025-07-03T12:35:03.000Z
Conflict-related rubble management cannot be completed within project timeline,"Management of asbestos-contaminated rubble from the 2023-2024 conflict at the Bakalian site cannot be completed within the Beirut project's timeline, requiring budget cancellation and deferral to future operations.",medium,persistent,The management of asbestos-contaminated rubble at the Bakalian site including its safe disposal cannot be completed within the project's timeline and therefore the budget allocated to this activity will be cancelled.,d961f4d7,P176635,Aide Memoire,2025-07-03T12:35:03.000Z
Delayed ESIA for Nabatieh SLF due to security issues,"Environmental and Social Impact Assessment for the Nabatieh sanitary landfill was delayed due to security issues, now under development since February 2025 with expected finalization by August 2025.",medium,improving,"The ESIA for the Nabatieh SLF was delayed due to security issues, however it is currently under development since February 2025 and is expected to be finalized by August 2025.",8cc78df3,P176635,Aide Memoire,2025-07-03T12:35:03.000Z
Occupational health and safety violations at Karantina facility amid conflict recovery,"Multiple serious OHS violations observed at Karantina Sorting Facility including inadequate PPE, unsecured work areas, and unreported incidents requiring hospitalization. Workers' safety at risk during post-conflict reconstruction.",high,new,"Workers were not equipped with appropriate Personal Protective Equipment (PPE), and none were wearing safety shoes... OHS incidents resulting in emergency hospital visits were recorded in the incident log however they were not reported to the World Bank.",f2b406e2,P176635,Aide Memoire,2025-07-03T12:35:03.000Z
Governance fragility affecting fund transfers and project execution,"Delays in transferring funds from Ministry of Finance treasury account to project Designated Account, with withdrawal applications facing extensive delays in processing by MoF and MoE, indicating governance and institutional capacity challenges.",medium,persistent,The withdrawal application requested by MoE in October 2024 has faced extensive delays in being processed by the Ministry of Finance (MoF) and MoE and is now being actively followed up by MoE to ensure its timely receipt in the project's designated account.,44f7622e,P176635,Aide Memoire,2025-07-03T12:35:03.000Z
Land compensation issues linked to economic crisis and displacement,"52% of expropriated landowners have not collected compensation due to Lebanese lira depreciation and absentee owners who left Lebanon, creating grievance risks and potential project delays for Zahle sewer network.",medium,persistent,"Remaining 13 plots, involving 27 landowners (52 %) still did not collect the compensation, mainly because the owners live abroad, the devaluation of the LBP decreased substantially the compensation amount in real terms, which combined with the complexity of the procedures to claim the compensation under the Lebanese Law left no incentive to collect the compensation.",ecff5104,P176635,Aide Memoire,2025-07-03T12:35:03.000Z
UNDP procurement delays due to internal governance and coordination challenges,"Beirut project faces continued delays in procurement due to lengthy internal UNDP procedures and external coordination challenges among government stakeholders, resulting in USD 2.2 million budget cancellation and activities no longer feasible.",high,worsening,"These delays are largely attributed to lengthy internal procedures and approval requirements within UNDP, which have significantly slowed implementation. Additionally, external coordination challenges among key government stakeholders have further compounded these delays.",2ae721b8,P176635,Aide Memoire,2025-07-03T12:35:03.000Z
