risk_title,risk_summary,severity,direction,evidence_quote,realized_risk_id,PROJ_ID_IB,doc_type,doc_date
Political and Governance Instability Constraining Project Implementation,"Lebanon faces persistent high-level political and governance risks that directly affect project implementation capacity and sustainability. The document indicates a 'High' political and governance risk rating maintained since project approval, reflecting ongoing fragility in the Lebanese state's ability to execute development programs.",high,persistent,Political and Governance High High High,dcc6a6b8,P180334,Implementation Status and Results Report,2025-08-20T21:25:09.000Z
Macroeconomic Crisis Threatening Project Viability,"Lebanon's severe macroeconomic crisis, rated 'High' throughout project implementation, poses fundamental risks to project sustainability and beneficiary participation. The economic collapse constrains government capacity to co-finance, maintain infrastructure, and support farmer/SME beneficiaries.",high,persistent,Macroeconomic High High High,bf4c191d,P180334,Implementation Status and Results Report,2025-08-20T21:25:09.000Z
Institutional Capacity Constraints for Implementation and Sustainability,Substantial institutional capacity risks persist for implementing project activities and ensuring long-term sustainability of investments. This reflects fragility in Lebanese government institutions' ability to execute complex agricultural development programs and maintain project-supported infrastructure.,high,persistent,Institutional Capacity for Implementation and Sustainability Substantial Substantial Substantial,4d0236c6,P180334,Implementation Status and Results Report,2025-08-20T21:25:09.000Z
Fiduciary Risk in Fragile Governance Context,"High fiduciary risk persists throughout implementation, reflecting concerns about financial management, procurement integrity, and accountability in Lebanon's fragile governance environment. This directly affects project fund utilization and beneficiary confidence.",high,persistent,Fiduciary High High High,00dfaaaf,P180334,Implementation Status and Results Report,2025-08-20T21:25:09.000Z
Delayed Project Effectiveness Affecting Implementation Timeline,"The project experienced significant delays in achieving effectiveness (14+ months between signing on 08-May-2024 and effectiveness on 04-Aug-2025), reflecting governance and political obstacles in ratifying loan agreements. This compressed timeline threatens implementation of planned activities.",medium,worsening,"The Lebanese Parliament has authorized the Government of Lebanon to ratify the Loan Agreement (Loan No. 9576-LB) by Law No. 17 dated July 11, 2025... the project was declared effective on August 4, 2025.",1f8843a7,P180334,Implementation Status and Results Report,2025-08-20T21:25:09.000Z
Minimal Project Disbursement Despite Effectiveness,"Only 0.25% of project funds ($0.50M of $200M) have been disbursed as of August 2025, despite project effectiveness. This suggests implementation bottlenecks in Lebanon's fragile institutional environment that may prevent timely fund utilization and activity execution.",high,new,IBRD-95760 Effective 200.00 200.00 0.00 0.50 199.50 0.25% Disbursed,286a9502,P180334,Implementation Status and Results Report,2025-08-20T21:25:09.000Z
