risk_title,risk_summary,severity,direction,evidence_quote,realized_risk_id,PROJ_ID_IB,doc_type,doc_date
Security situation delays project implementation in southern Lebanon,"Unstable security conditions in Nabatieh and Tyre service zones are impacting data collection and project activities, requiring shift to virtual meetings and remote tools to mitigate risks.",high,persistent,"Given the unstable security situation in Nabatieh and Tyre, the mission recommended that data collection efforts are based on virtual meetings and remote tools where possible to mitigate security risks and ensure continuity of the work.",f21ed5fe,P176635,Aide Memoire,2025-07-03T12:35:03.000Z
Component 2 implementation jeopardized by security escalation,"Security situation escalation in Lebanon has caused slippage in Component 2 implementation, potentially jeopardizing project development objectives. Activities were previously put on hold due to security concerns.",high,persistent,"Component 2 observed a slippage in implementation due to the security situation, its implementation may be jeopardizing the project development objectives.",3f8631fb,P176635,Aide Memoire,2025-07-03T12:35:03.000Z
Stakeholder opposition and threats to Srar Sanitary Landfill project,A landowner's brother operating an adjacent open dump has filed a grievance opposing the Srar SLF and is threatening to damage the facility if not included in the project. This requires resolution before civil works can commence.,high,new,"The complainant opposes the SLF because is operates an open dump landfill on the adjacent land plot. He is insisting to be included in the project as well, otherwise he is threatening he will damage the SLF supported by the project.",4b78cf70,P176635,Aide Memoire,2025-07-03T12:35:03.000Z
Conflict-related rubble management cannot be completed within project timeline,"Management of asbestos-contaminated rubble from the 2023-2024 conflict at the Bakalian site cannot be completed within the Beirut project's timeline, requiring budget cancellation and deferral to future operations.",medium,persistent,The management of asbestos-contaminated rubble at the Bakalian site including its safe disposal cannot be completed within the project's timeline and therefore the budget allocated to this activity will be cancelled.,d961f4d7,P176635,Aide Memoire,2025-07-03T12:35:03.000Z
Delayed ESIA for Nabatieh SLF due to security issues,"Environmental and Social Impact Assessment for the Nabatieh sanitary landfill was delayed due to security issues, now under development since February 2025 with expected finalization by August 2025.",medium,improving,"The ESIA for the Nabatieh SLF was delayed due to security issues, however it is currently under development since February 2025 and is expected to be finalized by August 2025.",8cc78df3,P176635,Aide Memoire,2025-07-03T12:35:03.000Z
Occupational health and safety violations at Karantina facility amid conflict recovery,"Multiple serious OHS violations observed at Karantina Sorting Facility including inadequate PPE, unsecured work areas, and unreported incidents requiring hospitalization. Workers' safety at risk during post-conflict reconstruction.",high,new,"Workers were not equipped with appropriate Personal Protective Equipment (PPE), and none were wearing safety shoes... OHS incidents resulting in emergency hospital visits were recorded in the incident log however they were not reported to the World Bank.",f2b406e2,P176635,Aide Memoire,2025-07-03T12:35:03.000Z
Governance fragility affecting fund transfers and project execution,"Delays in transferring funds from Ministry of Finance treasury account to project Designated Account, with withdrawal applications facing extensive delays in processing by MoF and MoE, indicating governance and institutional capacity challenges.",medium,persistent,The withdrawal application requested by MoE in October 2024 has faced extensive delays in being processed by the Ministry of Finance (MoF) and MoE and is now being actively followed up by MoE to ensure its timely receipt in the project's designated account.,44f7622e,P176635,Aide Memoire,2025-07-03T12:35:03.000Z
Land compensation issues linked to economic crisis and displacement,"52% of expropriated landowners have not collected compensation due to Lebanese lira depreciation and absentee owners who left Lebanon, creating grievance risks and potential project delays for Zahle sewer network.",medium,persistent,"Remaining 13 plots, involving 27 landowners (52 %) still did not collect the compensation, mainly because the owners live abroad, the devaluation of the LBP decreased substantially the compensation amount in real terms, which combined with the complexity of the procedures to claim the compensation under the Lebanese Law left no incentive to collect the compensation.",ecff5104,P176635,Aide Memoire,2025-07-03T12:35:03.000Z
UNDP procurement delays due to internal governance and coordination challenges,"Beirut project faces continued delays in procurement due to lengthy internal UNDP procedures and external coordination challenges among government stakeholders, resulting in USD 2.2 million budget cancellation and activities no longer feasible.",high,worsening,"These delays are largely attributed to lengthy internal procedures and approval requirements within UNDP, which have significantly slowed implementation. Additionally, external coordination challenges among key government stakeholders have further compounded these delays.",2ae721b8,P176635,Aide Memoire,2025-07-03T12:35:03.000Z
Security situation delays project implementation in southern Lebanon,"Unstable security conditions in Nabatieh and Tyre service zones are impacting data collection and project activities, requiring shift to virtual meetings and remote tools to mitigate risks.",high,persistent,"Given the unstable security situation in Nabatieh and Tyre, the mission recommended that data collection efforts are based on virtual meetings and remote tools where possible to mitigate security risks and ensure continuity of the work.",c7cf9ff6,P147854,Aide Memoire,2025-07-03T08:40:02.000Z
Component 2 implementation jeopardized by security escalation,"Security situation in Lebanon has caused slippage in Component 2 implementation, with activities previously put on hold due to escalation, potentially jeopardizing project development objectives.",high,persistent,"Component 2 observed a slippage in implementation due to the security situation, its implementation may be jeopardizing the project development objectives.",ec40d14b,P147854,Aide Memoire,2025-07-03T08:40:02.000Z
Stakeholder opposition and threats to Srar Sanitary Landfill project,A landowner's brother operating an adjacent open dump opposes the Srar SLF project and is threatening to damage it if not included in the project. This grievance must be resolved before civil works commence.,high,new,"The complainant opposes the SLF because is operates an open dump landfill on the adjacent land plot. He is insisting to be included in the project as well, otherwise he is threatening he will damage the SLF supported by the project. The mission communicated that these competing demands must be resolved by the MoE, Akkar Governor and the Union of Municipalities before any civil work start for the Srar SLF.",2e4b6b46,P147854,Aide Memoire,2025-07-03T08:40:02.000Z
Conflict-related rubble management activity cannot be completed within project timeline,"Management of asbestos-contaminated rubble from the 2023-2024 conflict at the Bakalian site cannot be completed within the project's timeline and budget will be cancelled, with implementation deferred to future operations.",medium,persistent,The mission acknowledged that the management of asbestos-contaminated rubble at the Bakalian site including its safe disposal cannot be completed within the project's timeline and therefore the budget allocated to this activity will be cancelled.,17076aa9,P147854,Aide Memoire,2025-07-03T08:40:02.000Z
Delayed ESIA for Nabatieh SLF due to security issues,"Environmental and Social Impact Assessment for Nabatieh sanitary landfill was delayed due to security issues, now under development since February 2025 with expected finalization by August 2025.",medium,improving,"The ESIA for the Nabatieh SLF was delayed due to security issues, however it is currently under development since February 2025 and is expected to be finalized by August 2025.",97bd0f44,P147854,Aide Memoire,2025-07-03T08:40:02.000Z
Governance fragility affecting fund transfers and project execution,"Withdrawal application from October 2024 faced extensive delays in processing by Ministry of Finance and Ministry of Environment, indicating governance challenges in fund management and project administration.",medium,persistent,The withdrawal application requested by MoE in October 2024 has faced extensive delays in being processed by the Ministry of Finance (MoF) and MoE and is now being actively followed up by MoE to ensure its timely receipt in the project's designated account.,432e5d69,P147854,Aide Memoire,2025-07-03T08:40:02.000Z
Occupational health and safety violations at Karantina facility amid conflict context,"Multiple serious OHS violations observed at Karantina Sorting Facility including inadequate PPE, unsecured work areas, and unreported incidents requiring hospitalization. Context of post-conflict reconstruction increases vulnerability.",high,new,"Workers were not equipped with appropriate Personal Protective Equipment (PPE), and none were wearing safety shoes... OHS incidents resulting in emergency hospital visits were recorded in the incident log however they were not reported to the World Bank.",86c98513,P147854,Aide Memoire,2025-07-03T08:40:02.000Z
Procurement delays at UNDP-implemented project due to governance and coordination challenges,"Beirut Critical Environmental Recovery project faces continued delays in procurement due to lengthy internal UNDP procedures and external coordination challenges among government stakeholders, resulting in USD 2.2 million budget cancellation.",high,worsening,"The project has faced continued delays in the processing of planned procurement activities. These delays are largely attributed to lengthy internal procedures and approval requirements within UNDP, which have significantly slowed implementation. Additionally, external coordination challenges among key government stakeholders have further compounded these delays.",8c446322,P147854,Aide Memoire,2025-07-03T08:40:02.000Z
Sporadic Armed Strikes Affecting Project Operations and Beneficiary Access,"Ongoing sporadic strikes on South Lebanon and Beirut's southern suburbs continue to pose risks to project implementation, staff safety, and beneficiary access to services despite the recent ceasefire.",medium,persistent,"However, sporadic strikes on South Lebanon and Beirut's southern suburbs continue, as the country is still grappling with a severe economic crisis marked by widespread poverty and instability.",2c703b22,P506127,Aide Memoire,2025-07-02T09:10:05.000Z
NGO Partner Capacity and Sustainability Challenges from Loss of Core Funding,"Several supported NGOs have lost core financing previously sourced from US resources and other development partners, creating near-term capacity and sustainability challenges that strain sub-grant negotiations and partner operations.",medium,worsening,"a key impact of the changing financing environment is the loss, for several supported NGOs, of core financing that was previously sourced from US resources or development partners managing these. This has created near-term capacity and sustainability challenges for some.",26a69e5b,P506127,Aide Memoire,2025-07-02T09:10:05.000Z
Contraction in International Development Financing Affecting NGO Sector Viability,"The international development financing environment is experiencing significant contraction, forcing NGOs to scale back operations and intensifying competition for limited resources, which has translated into difficult sub-grant negotiations and mobilization delays.",medium,worsening,"The international development financing environment is currently experiencing significant contraction, and this is having a profound impact on the NGO sector. Many non-governmental organizations are facing severe funding shortages as traditional donors reduce their aid budgets due to global economic challenges and shifting priorities. This financial strain has forced NGOs to scale back their operations, limit their programs, and in some cases, cease their activities altogether.",c3b20aa5,P506127,Aide Memoire,2025-07-02T09:10:05.000Z
Strain on NGO Partner Relations from Enhanced Due Diligence Processes,"Enhanced due diligence processes necessary to minimize fiduciary risk have created periods of strain in relationships with local NGO partners, particularly given the additional burdens imposed by the contracting financing environment.",low,persistent,"Despite these periods, which can strain relationships with local NGO partners, especially given the additional burdens imposed by the contracting financing environment, IRC has continued to manage partnerships effectively.",9661b8a1,P506127,Aide Memoire,2025-07-02T09:10:05.000Z
Security situation delays implementation in Nabatieh and Tyre service zones,"Unstable security conditions in Nabatieh and Tyre are impacting data collection for Local Solid Waste Master Plans, requiring shift to virtual meetings and remote tools to mitigate risks.",medium,persistent,"Given the unstable security situation in Nabatieh and Tyre, the mission recommended that data collection efforts are based on virtual meetings and remote tools where possible to mitigate security risks and ensure continuity of the work.",2a9d8df4,P172770,Aide Memoire,2025-07-02T09:00:03.000Z
Component 2 implementation jeopardized by security escalation,"Security situation in Lebanon has caused delays in Component 2 activities, with potential to jeopardize project development objectives. Activities were previously put on hold due to escalation in security situation.",high,persistent,"Component 2 observed a slippage in implementation due to the security situation, its implementation may be jeopardizing the project development objectives.",6e29eaa5,P172770,Aide Memoire,2025-07-02T09:00:03.000Z
Stakeholder opposition and threats to Srar Sanitary Landfill project,A grievance was received from a landowner's brother operating an adjacent open dump who opposes the SLF and threatens to damage it if not included in the project. This competing demand must be resolved before civil works commence.,high,new,"The complainant opposes the SLF because is operates an open dump landfill on the adjacent land plot. He is insisting to be included in the project as well, otherwise he is threatening he will damage the SLF supported by the project. The mission communicated that these competing demands must be resolved by the MoE, Akkar Governor and the Union of Municipalities before any civil work start for the Srar SLF.",1e4ae77e,P172770,Aide Memoire,2025-07-02T09:00:03.000Z
ESIA for Nabatieh SLF delayed due to security issues,"The Environmental and Social Impact Assessment for the Kfartebnit Sanitary Landfill in Nabatieh was delayed due to security issues, now under development since February 2025 with expected completion by August 2025.",medium,persistent,"The ESIA for the Nabatieh SLF was delayed due to security issues, however it is currently under development since February 2025 and is expected to be finalized by August 2025.",479c4ac7,P172770,Aide Memoire,2025-07-02T09:00:03.000Z
Conflict-related rubble management activity cannot be completed within project timeline,"Management of asbestos-contaminated rubble at the Bakalian site from the 2023-2024 conflict cannot be completed within the project's timeline, requiring budget cancellation and deferral to future operations.",medium,persistent,The management of asbestos-contaminated rubble at the Bakalian site including its safe disposal cannot be completed within the project's timeline and therefore the budget allocated to this activity will be cancelled.,f671b7bf,P172770,Aide Memoire,2025-07-02T09:00:03.000Z
Occupational health and safety violations at Karantina facility amid conflict recovery,"Multiple serious OHS violations observed at Karantina Sorting Facility including inadequate PPE, unsecured work areas, and unreported incidents requiring hospitalization. Workers' safety at risk during critical post-conflict reconstruction work.",high,worsening,"Workers were not equipped with appropriate Personal Protective Equipment (PPE), and none were wearing safety shoes... OHS incidents resulting in emergency hospital visits were recorded in the incident log however they were not reported to the World Bank.",89b171dc,P172770,Aide Memoire,2025-07-02T09:00:03.000Z
Grievance mechanism gaps for workers at Karantina facility,"Workers report grievances verbally on site and these are included in contractor reports, but UNDP does not record them in the grievance log or reports to the Bank, creating accountability gaps.",medium,new,"During the site visit, it was noted that workers report grievance, feedback or complaints on site, often verbally and these are included in the Contractor's monthly reports, however UNDP does not record these in the grievance log and in the reports to the Bank.",d9b7e3d1,P172770,Aide Memoire,2025-07-02T09:00:03.000Z
Land expropriation compensation delays affecting project beneficiaries,"52% of expropriated landowners (27 out of 50) have not collected compensation for land taken for Zahle sewer network, primarily due to absentee owners who left Lebanon and currency depreciation making compensation negligible.",medium,persistent,"Remaining 13 plots, involving 27 landowners (52 %) still did not collect the compensation, mainly because the owners live abroad, the devaluation of the LBP decreased substantially the compensation amount in real terms, which combined with the complexity of the procedures to claim the compensation under the Lebanese Law left no incentive to collect the compensation.",f8b08055,P172770,Aide Memoire,2025-07-02T09:00:03.000Z
Conflict-driven economic crisis reducing landowner incentive to claim compensation,"The 2019 economic crisis and Lebanese lira depreciation have reduced compensation amounts to negligible levels (USD 27-728 per plot), eliminating incentive for landowners to claim expropriation compensation.",medium,persistent,"Of these, 10 plots were compensated before the onset of the 2019 economic crisis, while the owners of 2 plots collected compensation afterward... the devaluation of the LBP decreased substantially the compensation amount in real terms, which combined with the complexity of the procedures to claim the compensation under the Lebanese Law left no incentive to collect the compensation.",c13d0439,P172770,Aide Memoire,2025-07-02T09:00:03.000Z
Political and Governance Instability Affecting Project Implementation,"Political and governance risks remain at High level, indicating ongoing fragility in the operating environment that could impact project execution and sustainability of sewage treatment infrastructure.",high,persistent,Political and Governance High High High,9e93c4c0,P147854,Implementation Status and Results Report,2025-06-27T18:40:23.000Z
Macroeconomic Crisis Impacting Project Viability,"Macroeconomic risk has escalated from Moderate at approval to High, suggesting severe economic instability in Lebanon that threatens project financial sustainability and operational capacity of treatment facilities.",high,worsening,Macroeconomic Moderate High High,7e9bda28,P147854,Implementation Status and Results Report,2025-06-27T18:40:23.000Z
Institutional Capacity Constraints in Fragile Context,"While institutional capacity risk has improved from Substantial to Moderate, the project operates in a context of governance fragility where implementing agencies may face challenges sustaining operations of completed infrastructure.",medium,improving,Institutional Capacity for Implementation and Sustainability Substantial Moderate Moderate,c05c8bd6,P147854,Implementation Status and Results Report,2025-06-27T18:40:23.000Z
Security Escalation Causing Implementation Delays in South Lebanon,"Escalation of the security situation in South Lebanon has led to detention of project interventions in that region, directly impacting implementation of solid waste management measures and UPOPs reduction activities.",high,worsening,"However, due to the escalation of the security situation in South Lebanon, the interventions in South Lebanon were detained.",802c79fa,P172770,Implementation Status and Results Report,2025-06-27T18:35:06.000Z
Persistent High Political and Governance Risk,"Political and governance risk remains rated as High, consistent with approval and previous assessments, indicating ongoing fragility in the operating environment that could affect project implementation and sustainability.",high,persistent,Political and Governance High High High,b8dee5c9,P172770,Implementation Status and Results Report,2025-06-27T18:35:06.000Z
Deteriorating Fiduciary Risk Environment,"Fiduciary risk has worsened from Substantial (at approval and last review) to High in the current proposed rating, suggesting emerging concerns about financial management and implementation capacity in the fragile context.",high,worsening,Fiduciary Substantial Moderate High,b1c2202e,P172770,Implementation Status and Results Report,2025-06-27T18:35:06.000Z
Macroeconomic Crisis Affecting Project Sustainability,"Lebanon's severe macroeconomic crisis is creating substantial risks to project implementation and the sustainability of social services for vulnerable groups, as indicated by the Substantial macroeconomic risk rating that has persisted since project approval.",high,persistent,Macroeconomic Substantial Substantial Substantial,a92ee913,P506127,Implementation Status and Results Report,2025-06-27T17:50:14.000Z
Political and Governance Instability Impacting Implementation,"Political and governance fragility in Lebanon poses moderate but persistent risks to project implementation, affecting the ability of government and NGO partners to deliver services to vulnerable populations.",medium,persistent,Political and Governance Moderate Moderate Moderate,c25083b2,P506127,Implementation Status and Results Report,2025-06-27T17:50:14.000Z
Fiduciary Risk in NGO Partner Management,"Substantial fiduciary risks persist in the management of sub-grants to NGO partners, which may be exacerbated by governance fragility and could affect the proper use of funds for vulnerable groups.",high,persistent,Fiduciary Substantial Substantial Substantial,aea155bb,P506127,Implementation Status and Results Report,2025-06-27T17:50:14.000Z
Vulnerability of Service Delivery in Conflict-Affected Areas,"The project operates in Lebanon, a country experiencing significant fragility, and serves vulnerable populations including GBV survivors, persons with mental health challenges, and displaced persons who may face ongoing security and access challenges.",high,persistent,To expand support for the immediate social recovery needs of vulnerable groups in Lebanon,ec0ead29,P506127,Implementation Status and Results Report,2025-06-27T17:50:14.000Z
Delayed Project Effectiveness Due to Parliamentary Ratification Requirements,"The IBRD loan Financing Agreement is undergoing government internal clearances before parliamentary ratification, a country requirement for loan effectiveness. This delays project commencement during the critical post-war recovery phase.",high,persistent,"The Financing Agreement (IBRD loan) is now undergoing government internal clearances before being submitted to the Parliament for ratification, a country requirement for loan effectiveness. As the project aims to help Lebanon restore core fiscal management functions, namely domestic revenue mobilization and the accountable allocation and use of public resources, timely commencement of the project is even more critical for the post-war recovery phase.",e7d29e04,P181155,Implementation Status and Results Report,2025-06-24T11:55:17.000Z
High Political and Governance Risk Rating Affecting Implementation,"The project carries a 'High' risk rating in both Political and Governance and Macroeconomic categories, indicating significant fragility in the operating environment that could impede fiscal management reforms and institutional capacity building.",high,persistent,Risk Category: Political and Governance - Rating: High; Macroeconomic - Rating: High,61778598,P181155,Implementation Status and Results Report,2025-06-24T11:55:17.000Z
High Institutional Capacity Risk for Implementation and Sustainability,"The project faces 'High' risk in institutional capacity for implementation and sustainability, suggesting weak government institutions may struggle to execute fiscal management reforms and maintain accountability mechanisms.",high,persistent,Risk Category: Institutional Capacity for Implementation and Sustainability - Rating: High,ed13e42e,P181155,Implementation Status and Results Report,2025-06-24T11:55:17.000Z
High Fiduciary Risk in Post-Conflict Environment,"The project carries a 'High' fiduciary risk rating, indicating concerns about financial management, procurement, and accountability in the fragile post-war Lebanese context.",high,persistent,Risk Category: Fiduciary - Rating: High,5e03867d,P181155,Implementation Status and Results Report,2025-06-24T11:55:17.000Z
