risk_title,risk_summary,severity,direction,evidence_quote,realized_risk_id,PROJ_ID_IB,doc_type,doc_date
Macroeconomic Crisis Affecting Project Sustainability,"Lebanon's severe macroeconomic crisis (rated 'Substantial' in SORT) is creating structural challenges for project implementation and the sustainability of social services for vulnerable groups, particularly given the project's reliance on local NGO partners operating in a deteriorating economic environment.",high,persistent,Macroeconomic Substantial Substantial Substantial,e67df622,P506127,Implementation Status and Results Report,2025-10-23T11:05:16.000Z
Institutional Capacity Constraints in Fragile Context,"Moderate institutional capacity for implementation and sustainability poses risks to the project's ability to deliver services through local NGO sub-grantees in Lebanon's fragile governance environment, with capacity-building efforts still ongoing.",medium,persistent,Institutional Capacity for Implementation and Sustainability Moderate Moderate Moderate,23252564,P506127,Implementation Status and Results Report,2025-10-23T11:05:16.000Z
Fiduciary Risk in Conflict-Affected Setting,"Substantial fiduciary risk rating reflects challenges in financial management and accountability mechanisms within Lebanon's fragile institutional context, affecting the project's ability to ensure proper fund utilization across 11 sub-projects.",high,persistent,Fiduciary Substantial Substantial Substantial,1871aead,P506127,Implementation Status and Results Report,2025-10-23T11:05:16.000Z
Owner Access Denial Blocking Structural Works,"Rehabilitation of Re_679 was significantly delayed when an owner on the third floor refused to grant access to their apartment, blocking structural works on the second floor and above. Access was eventually obtained through legal channels, but this demonstrates vulnerability to individual owner obstruction in a fragile post-conflict environment.",medium,improving,"The rehabilitation of Re_679 has been delayed due to the refusal of an owner on the third floor to grant access to their apartment, which in turn has blocked structural works on the second floor and above (the building has eight floors in total). Since the last mission, access to the apartment has been obtained through legal channels, and UN-Habitat has been able to remove the furniture and receive the unit.",d43e0ad4,P176577,Aide Memoire,2025-10-14T05:20:05.000Z
Accumulated Utility Bills Creating Access Barriers for Rehabilitated Units,"Units have accumulated electricity and water bills over five years despite being vacant since the blast. Service providers are reluctant to reconnect utilities, requiring high-level negotiations. This creates barriers to occupancy and beneficiary access to rehabilitated housing in a context of economic fragility.",medium,persistent,"In some cases, this required high-level discussions with service providers, as many units have accumulated bills over the past five years, even though they have been vacant since the explosion.",9c481216,P176577,Aide Memoire,2025-10-14T05:20:05.000Z
Tight Implementation Timeline with No Slippage Tolerance in High-Risk Buildings,"Three buildings (Ac_726, Re_679, Re_710) have compressed completion timelines with no room for unforeseen challenges. Re_679 and Re_710 are flagged as high-risk with October completion deadlines. Any disruption—security incidents, labor disputes, or supply chain issues—could prevent completion before project closing on October 31, 2025.",high,persistent,"Progress on the buildings flagged as high-risk is on track, but the timeline for rehabilitation works is tight, with no room for slippages... However, the timeline for completing the works is tight, leaving no room for any unforeseen challenges.",f4ede735,P176577,Aide Memoire,2025-10-14T05:20:05.000Z
Potential Post-Closure Environmental and Social Compliance Gaps,"A Post-Closure Action Plan (PCAP) has been prepared as a contingency for worst-case scenarios where activities may not be completed by the closing date (October 31, 2025). This indicates concern that E&S requirements may not be fully met, particularly for Re_679 and Re_710, creating potential compliance and reputational risks.",medium,unclear,"The mission discussed potential worst-case scenarios in which certain activities may not be completed by the closing date, thereby triggering specific environmental and social (E&S) requirements—particularly for Re_679 and Re_710. The Bank outlined the circumstances under which a PCAP would be required and the key elements it should contain. A draft PCAP has been prepared by the Bank team and was shared with UN-Habitat as a contingency measure.",1dca5ca7,P176577,Aide Memoire,2025-10-14T05:20:05.000Z
Incidents and Accidents During Reconstruction Works,"Two incidents occurred in August 2025 during rehabilitation works. While addressed appropriately, ongoing construction in a post-blast environment with compressed timelines and extended working hours (including weekends and holidays) creates elevated occupational health and safety risks.",medium,unclear,UN-Habitat informed the Bank team that two incidents occurred in August 2025 and were addressed appropriately. The Bank shared the Environmental and Social Incident Reporting Tool (ESIRT) protocol with UN-Habitat to ensure proper reporting.,ff8e4867,P176577,Aide Memoire,2025-10-14T05:20:05.000Z
High Volume of Stakeholder Grievances Related to Reconstruction Activities,"742 stakeholder grievances have been recorded since project start (660 grievances and 182 inquiries), with 122 recorded since May 2025. Most relate to dust, noise, and owner inquiries. This reflects community tensions and dissatisfaction with reconstruction impacts in a post-conflict urban setting.",medium,persistent,"Under Component 1, a total of 742 stakeholder grievances have been recorded and addressed since the beginning of the project (660 grievances and 182 inquiries), out of which 122 were recorded since May 2025. Most relate to owners' inquiries and local residents' complaints about dust and noise.",0856e1c9,P176577,Aide Memoire,2025-10-14T05:20:05.000Z
Political and Governance Instability Affecting Implementation,"Political and governance fragility in Lebanon continues to pose a high risk to project implementation, as indicated by the sustained 'High' rating in the Political and Governance risk category across all assessment periods.",high,persistent,Political and Governance High High High,0b69ff45,P176577,Implementation Status and Results Report,2025-10-13T23:15:06.000Z
Macroeconomic Crisis Impacting Project Delivery,"Lebanon's macroeconomic instability remains a persistent high-level risk affecting the project's ability to implement activities and sustain results, with the rating maintained at 'High' throughout the project lifecycle.",high,persistent,Macroeconomic High High High,6937c593,P176577,Implementation Status and Results Report,2025-10-13T23:15:06.000Z
Stakeholder Tensions and Coordination Challenges,"High-level stakeholder risks persist, potentially reflecting tensions between government entities, development actors, and beneficiary communities in the post-explosion recovery context.",high,persistent,Stakeholders High High High,5a6ecccb,P176577,Implementation Status and Results Report,2025-10-13T23:15:06.000Z
Political and Governance Instability Impeding Project Implementation,"Political and governance fragility is preventing critical project activities from proceeding, including the inability to obtain necessary approvals from Beirut Governorate and Municipality for waste management drop-off centers, and delays in Parliament ratification of follow-on financing.",high,persistent,"Detailed feasibility study and site development plan for the establishment of 10 drop off centers in Beirut has been completed, however, the centers/points could not obtain necessary approvals from Beirut Governorate and Municipality.",4c09d0f2,P176635,Implementation Status and Results Report,2025-10-13T20:45:14.000Z
Governance Capacity Constraints Affecting Project Closure and Sustainability,"Weak institutional capacity and governance fragility are preventing timely operationalization of rehabilitated infrastructure, with the bidding process for facility operator delayed until after project closure, jeopardizing sustainability and beneficiary realization.",high,persistent,"Although the Karantina facility has been rehabilitated, the bidding process to select an operator is expected to commence after the closure of the project.",639c646b,P176635,Implementation Status and Results Report,2025-10-13T20:45:14.000Z
Political Instability Delaying Critical Environmental Remediation Activities,"Political and governance fragility is preventing the implementation of environmentally critical contaminated rubble management activities within the project timeline, requiring transfer to a follow-on project pending Parliament ratification.",high,persistent,"However, activities aimed at ensuring the environmentally safe management of contaminated rubble cannot be implemented within the current project timeline. It has been agreed that these activities will be carried out under the World Bank-funded Lebanon Emergency Assistance Project which is pending ratification by Parliament.",e1a9af30,P176635,Implementation Status and Results Report,2025-10-13T20:45:14.000Z
Political and Governance Instability Affecting Project Implementation,"Political and governance fragility in Lebanon is rated as High risk at project approval, directly impacting the project's ability to implement recovery and reconstruction activities in conflict-affected areas.",high,persistent,Political and Governance High High,6b82421b,P509428,Implementation Status and Results Report,2025-09-24T20:30:33.000Z
Stakeholder Engagement Challenges in Conflict-Affected Context,"Stakeholder risks are rated as High, indicating significant challenges in engaging with communities and authorities in conflict-affected areas of Lebanon during project implementation.",high,persistent,Stakeholders High High,412ad42a,P509428,Implementation Status and Results Report,2025-09-24T20:30:33.000Z
Institutional Capacity Constraints in Fragile Governance Environment,"Institutional capacity for implementation and sustainability is rated as High risk, reflecting challenges in Lebanon's fragile governance context to effectively manage and sustain project activities.",high,persistent,Institutional Capacity for Implementation and Sustainability High High,7eee8269,P509428,Implementation Status and Results Report,2025-09-24T20:30:33.000Z
Macroeconomic Instability Threatening Project Viability,"Macroeconomic risk is rated as High, which in Lebanon's context of economic crisis and conflict may undermine project implementation capacity and sustainability of restored services.",high,persistent,Macroeconomic High High,71af28cb,P509428,Implementation Status and Results Report,2025-09-24T20:30:33.000Z
Political and Governance Instability Constraining Project Implementation,"Lebanon faces persistent high-level political and governance risks that directly affect project implementation capacity and sustainability. The document indicates a 'High' political and governance risk rating maintained since project approval, reflecting ongoing fragility in the Lebanese state's ability to execute development programs.",high,persistent,Political and Governance High High High,dcc6a6b8,P180334,Implementation Status and Results Report,2025-08-20T21:25:09.000Z
Macroeconomic Crisis Threatening Project Viability,"Lebanon's severe macroeconomic crisis, rated 'High' throughout project implementation, poses fundamental risks to project sustainability and beneficiary participation. The economic collapse constrains government capacity to co-finance, maintain infrastructure, and support farmer/SME beneficiaries.",high,persistent,Macroeconomic High High High,bf4c191d,P180334,Implementation Status and Results Report,2025-08-20T21:25:09.000Z
Institutional Capacity Constraints for Implementation and Sustainability,Substantial institutional capacity risks persist for implementing project activities and ensuring long-term sustainability of investments. This reflects fragility in Lebanese government institutions' ability to execute complex agricultural development programs and maintain project-supported infrastructure.,high,persistent,Institutional Capacity for Implementation and Sustainability Substantial Substantial Substantial,4d0236c6,P180334,Implementation Status and Results Report,2025-08-20T21:25:09.000Z
Fiduciary Risk in Fragile Governance Context,"High fiduciary risk persists throughout implementation, reflecting concerns about financial management, procurement integrity, and accountability in Lebanon's fragile governance environment. This directly affects project fund utilization and beneficiary confidence.",high,persistent,Fiduciary High High High,00dfaaaf,P180334,Implementation Status and Results Report,2025-08-20T21:25:09.000Z
Delayed Project Effectiveness Affecting Implementation Timeline,"The project experienced significant delays in achieving effectiveness (14+ months between signing on 08-May-2024 and effectiveness on 04-Aug-2025), reflecting governance and political obstacles in ratifying loan agreements. This compressed timeline threatens implementation of planned activities.",medium,worsening,"The Lebanese Parliament has authorized the Government of Lebanon to ratify the Loan Agreement (Loan No. 9576-LB) by Law No. 17 dated July 11, 2025... the project was declared effective on August 4, 2025.",1f8843a7,P180334,Implementation Status and Results Report,2025-08-20T21:25:09.000Z
Minimal Project Disbursement Despite Effectiveness,"Only 0.25% of project funds ($0.50M of $200M) have been disbursed as of August 2025, despite project effectiveness. This suggests implementation bottlenecks in Lebanon's fragile institutional environment that may prevent timely fund utilization and activity execution.",high,new,IBRD-95760 Effective 200.00 200.00 0.00 0.50 199.50 0.25% Disbursed,286a9502,P180334,Implementation Status and Results Report,2025-08-20T21:25:09.000Z
Political and Governance Instability Affecting Project Implementation,"Political and governance fragility in Lebanon continues to pose a high risk to project implementation, as indicated by the sustained 'High' rating in the Political and Governance risk category across all assessment periods.",high,persistent,Political and Governance High High High,af6c4f0a,P176577,Implementation Status and Results Report,2025-08-07T16:15:13.000Z
Delays in Housing Recovery Component Amid Fragile Context,"Component 1 implementation delays are creating risks to PDO achievement, particularly for three high-risk buildings with tight completion timelines before project closure, in a context of broader political and governance instability.",high,worsening,"delays in Component 1 pose a risk to full Project Development Objective achievement, particularly for three high-risk buildings with tight completion timelines",f5536b0a,P176577,Implementation Status and Results Report,2025-08-07T16:15:13.000Z
Stakeholder Tensions and Engagement Challenges,"High-risk stakeholder dynamics are affecting project implementation, with the Stakeholders risk category rated as 'High' across all assessment periods, indicating persistent tensions between government and development actors or among beneficiary groups.",high,persistent,Stakeholders High High High,9db12d08,P176577,Implementation Status and Results Report,2025-08-07T16:15:13.000Z
Macroeconomic Crisis Impacting Project Viability,"Lebanon's macroeconomic crisis remains a persistent high risk affecting project implementation and sustainability, with the Macroeconomic risk category rated 'High' across all assessment periods.",high,persistent,Macroeconomic High High High,87dda27d,P176577,Implementation Status and Results Report,2025-08-07T16:15:13.000Z
Political and Governance Instability Constraining Implementation,"Political and governance fragility in Lebanon is rated as 'High' and remains a persistent constraint on project implementation, contributing to the overall 'High' risk rating and 'Moderately Unsatisfactory' implementation progress.",high,persistent,Political and Governance High High High,f46a16fe,P163476,Implementation Status and Results Report,2025-08-01T20:45:09.000Z
Macroeconomic Crisis Worsening Implementation Environment,"Macroeconomic risk has escalated from 'Moderate' at approval to 'High' in the current rating, indicating a worsening economic crisis affecting project implementation capacity and sustainability.",high,worsening,Macroeconomic Moderate High High,421b1ef4,P163476,Implementation Status and Results Report,2025-08-01T20:45:09.000Z
Institutional Capacity Strain Despite High Rating,"While institutional capacity for implementation is rated 'High', the project's 'Moderately Unsatisfactory' overall implementation progress and multiple restructurings (4 Level 2 restructurings since 2020) suggest persistent capacity constraints in executing project activities amid fragile governance conditions.",high,persistent,Overall Implementation Progress (IP) Moderately Unsatisfactory Moderately Unsatisfactory,ce979697,P163476,Implementation Status and Results Report,2025-08-01T20:45:09.000Z
Displacement Pressures Affecting Service Delivery Targets,"The project targets displaced Syrians in Lebanon (180,000 beneficiaries planned), but zero beneficiaries have been enrolled to date as of August 2025, indicating implementation challenges in reaching this vulnerable displaced population amid ongoing displacement and conflict-related pressures.",high,persistent,"Displaced Syrians (Number) 0.00 Apr/2023 0.00 15-Aug-2024 0.00 15-Aug-2024 180,000.00 Mar/2026",d6420bf9,P163476,Implementation Status and Results Report,2025-08-01T20:45:09.000Z
Conflict-Related Healthcare Needs Unmet,"The indicator for 'Eligible beneficiaries with conflict-related sickness or injuries whose hospitalization costs in public hospitals are financed' shows zero beneficiaries served to date, despite a target of 6,000 by project closing, indicating inability to reach conflict-affected populations.",high,persistent,"Eligible beneficiaries with conflict-related sickness or injuries whose hospitalization costs in public hospitals are financed (Number) 0 Apr/2023 0 20-Oct-2024 0 20-Oct-2024 6,000 Mar/2026",1fa32eb9,P163476,Implementation Status and Results Report,2025-08-01T20:45:09.000Z
Internally Displaced Population Services Not Operationalized,"The project component targeting 'Registered Internally Displaced Population receiving emergency secondary healthcare services in public hospitals' has enrolled zero beneficiaries as of October 2024, despite a target of 20,000, indicating implementation barriers in serving internally displaced populations.",high,persistent,"Registered Internally Displaced Population receiving emergency secondary healthcare services in public hospitals (Number) 0 Apr/2023 0 20-Oct-2024 0 20-Oct-2024 20,000 Mar/2026",03205b4e,P163476,Implementation Status and Results Report,2025-08-01T20:45:09.000Z
Challenging National Context Affecting Project Implementation,"The document acknowledges a 'challenging situation in the country' that could impede project implementation timelines and effectiveness, though specific FCV dynamics are not detailed.",medium,persistent,"Despite the challenging situation in the country, preparatory activities are progressing and the Ministry of Environment remains committed to implement the project in a timely manner.",362acca4,P500390,Implementation Status and Results Report,2025-07-29T21:25:12.000Z
High Political and Governance Risk in Lebanon,Lebanon faces sustained high political and governance risk that directly affects project implementation capacity and stability. This risk has persisted across all rating cycles and remains at the highest severity level.,high,persistent,"Risk Category: Political and Governance - Rating at Approval: High, Last Approved Rating ISR Seq. 04 - 11 Apr 2024: High",e5a79b50,P178587,Implementation Status and Results Report,2025-07-29T21:21:25.000Z
Macroeconomic Crisis Impacting Project Implementation,Lebanon's macroeconomic instability presents a high and persistent risk to project implementation. The country's severe economic crisis affects the implementing agency's capacity to execute project activities and sustain operations.,high,persistent,"Risk Category: Macroeconomic - Rating at Approval: High, Last Approved Rating ISR Seq. 04 - 11 Apr 2024: High",30a87fbf,P178587,Implementation Status and Results Report,2025-07-29T21:21:25.000Z
Refugee and Host Community Pressures on Health System,"The project explicitly targets refugee populations (Syrian and Palestinian) and host communities, indicating displacement-related pressures on Lebanon's fragile health system. Project indicators track refugee utilization of services, reflecting underlying FCV-related population pressures.",medium,persistent,"Percentage of hospital visits by refugees (Syrians and Palestinians) in public hospitals which have benefited from project support (Percentage) - Baseline 35.00 May/2022, Target 40 30-Dec-2025",669f29f5,P178587,Implementation Status and Results Report,2025-07-29T21:21:25.000Z
Owner Disputes and Access Restrictions Due to Alleged Theft,"Rehabilitation works for building RE_679 have been paused due to an alleged theft incident on June 1-2, 2024, where owners claim valuables and cash worth US$70,000 were stolen from a safe. Owners subsequently restricted site access, demanding compensation, increased transparency, and reduced delays. This has caused at least a 6-week delay in rehabilitation works and creates risk of contract termination if parties cannot reach agreement.",high,persistent,"Over the weekend of June 1-2, 2024, an alleged theft occurred in building Re_679, one of the buildings currently under rehabilitation. The owner claims that a safe, left on site in one of the apartments, was broken into, stealing valuables and cash valuing US$70,000. Subsequently, the owners restricted access to the site, demanding compensation, increased transparency, and reduced delays.",4f6f22f7,P176577,Aide Memoire,2025-07-09T20:00:12.000Z
Family Disputes Delaying Deed of Commitments Signatures,"Family disputes among building owners regarding terms of Deeds of Commitment (DoCs) have significantly delayed the securing of 3 DoCs, which are crucial for commencement of rehabilitation works. Disagreements among family members have stalled progress and made it challenging to obtain necessary consents in a timely manner.",medium,persistent,"Family disputes and the time taken by some owners to review the documents have significantly delayed the securing of 3 DoCs, which are crucial for the commencement of rehabilitation works. In several cases, disagreements among family members regarding the terms of the DoC have stalled progress, making it challenging to obtain the necessary consents in a timely manner.",453f702c,P176577,Aide Memoire,2025-07-09T20:00:12.000Z
Public Sector Capacity Constraints Affecting Permitting Process,"Reduction in working hours of the public sector has caused substantial delays in permit approval processes, affecting 2 buildings. These disruptions have delayed the start of rehabilitation works and represent a governance fragility issue affecting project implementation.",medium,persistent,"The process of obtaining permits has not been obtained for 2 buildings due to a reduction in working hours of the public sectors. These disruptions have caused substantial delays in the approval process, which in turn has delayed the start of rehabilitation works.",5818c342,P176577,Aide Memoire,2025-07-09T20:00:12.000Z
Reputational Risk from Building Cancellations and Unmet Owner Expectations,"Proposed cancellation of buildings (RE_364, RE_679, and potentially RE_714) creates reputational risks as owner and tenant expectations have been raised through consultation processes. The World Bank notes that reputational and other risks would likely be higher if works were started but not completed prior to project closing date, creating tension between development actors and beneficiary communities.",medium,new,"UN-Habitat noted that cancellation would result in reputational risks, given the owners and tenant's expectations have been raised through the consultation process to date. The World Bank notes that reputational and other risks would likely be higher in the case that works were started but not completed prior to the project closing date.",718622dc,P176577,Aide Memoire,2025-07-09T20:00:12.000Z
Tight Project Timeline Creating Risk of Incomplete Works and Financing Ineligibility,"The project closing date of June 30, 2025 creates a compressed schedule with little buffer for delays. Multiple buildings have expected completion dates in May-June 2025, leaving minimal time for unforeseen challenges. Expenditures for works carried out after the closing date would not be eligible for World Bank financing, creating pressure on implementation and potential conflict between project requirements and beneficiary needs.",high,worsening,"The project faces considerable implementation risks due to the tight timeline for completing the rehabilitation works, particularly for buildings with expected completion dates in May and June 2025. With the project closing date set for June 30, 2025, this compressed schedule leaves little room for additional delays or unforeseen challenges, which could significantly impact the project's completion within the current project timeframe.",cdf388b2,P176577,Aide Memoire,2025-07-09T20:00:12.000Z
