risk_title,risk_summary,severity,direction,evidence_quote,realized_risk_id,PROJ_ID_IB,doc_type,doc_date
Salary Payment Arrears Beyond Project Control Affecting Implementation Credibility,"Over 10 months of salary arrears due to fiscal constraints and lack of government prioritization are creating implementation challenges and undermining project credibility, though beyond project control.",high,persistent,The over 10 months' delay in payment of salaries has posed challenges for the PDOI target on 'timely release of central government salaries and state transfers' to be achieved.,99f4448b,P176761,Aide Memoire,2025-07-03T16:40:03.000Z
Weak Coordination Between Shared Project Implementation Units Causing Administrative Delays,"Weak coordination between the PFMIS and ECRP II project implementation units sharing resources has generated administrative and procurement delays, with potential changes to shared-services model still under analysis.",medium,persistent,"This project is sharing some PIU resources with the South Sudan Enhancing Community Resilience and Local Governance Project (ECRP II), but weak coordination between both project implementation units (PIUs) has generated administrative and procurement delays.",f7a5b178,P176761,Aide Memoire,2025-07-03T16:40:03.000Z
Organizational Restructuring of Ministry of Finance Not Yet Reflected in Project,"The 2023 organizational restructuring of the Ministry of Finance and Planning has not been reflected in the project institutional arrangements, creating potential misalignment between project design and government structure.",medium,persistent,"In 2023, the MoFP implemented an organizational restructuring which needs to be reflected in the project.",9111244e,P176761,Aide Memoire,2025-07-03T16:40:03.000Z
Unresolved Grievance Redress Mechanism Limiting Project Accountability,"The Grievance Redress Mechanism has not been rolled out, preventing registration or resolution of community grievances and limiting project accountability to affected populations.",medium,persistent,Challenges with ESRM persist: (i) Environmental Specialist in the PIU is yet to be replaced; (ii) the Grievance Redress Mechanism (GRM) is yet to be rolled out hence no cases were registered or resolved,b64647f4,P176761,Aide Memoire,2025-07-03T16:40:03.000Z
Political and Governance Instability Affecting Implementation,"Political and governance risks remain high and are constraining project implementation, as evidenced by the sustained 'High' rating in the Political and Governance risk category.",high,persistent,Political and Governance High High,5489a898,P177663,Implementation Status and Results Report,2025-06-30T21:35:30.000Z
Macroeconomic Instability Impacting Project Viability,"Macroeconomic risks are rated as high and persistent, potentially affecting the sustainability of cash transfer operations and beneficiary purchasing power.",high,persistent,Macroeconomic High High,bc5d4090,P177663,Implementation Status and Results Report,2025-06-30T21:35:30.000Z
Sector Strategy and Policy Fragility,"High-risk sector strategies and policies continue to constrain the enabling environment for social protection system strengthening, despite ongoing policy review activities.",high,persistent,Sector Strategies and Policies High High,310083af,P177663,Implementation Status and Results Report,2025-06-30T21:35:30.000Z
Institutional Capacity Constraints in Fragile Context,"Institutional capacity for implementation and sustainability remains high-risk, reflecting the fragility of government systems in South Sudan and their limited ability to sustain social protection delivery.",high,persistent,Institutional Capacity for Implementation and Sustainability High High,d6b4d5fe,P177663,Implementation Status and Results Report,2025-06-30T21:35:30.000Z
Fiduciary Risks in Fragile State Context,"Fiduciary risks are rated as high, reflecting governance fragility and potential challenges in financial management and accountability in the South Sudan context.",high,persistent,Fiduciary High High,4c9a4372,P177663,Implementation Status and Results Report,2025-06-30T21:35:30.000Z
Refugee and Host Community Tensions,"The project is operating in a context with significant refugee populations and host community pressures, as evidenced by dedicated targeting of both groups, which may create social tensions if benefits are perceived as inequitable.",medium,unclear,"Beneficiary households of social safety net programs- Refugees (Number) 0 Aug/2022 0 11-Oct-2024 6,298 20-Jun-2025 24,000.00 Jun/2027 Beneficiary households of social safety net programs - Host Communities (Number) 0 Aug/2022 0 11-Oct-2024 78,570 20-Jun-2025 38,500 Jun/2027",757ee696,P177663,Implementation Status and Results Report,2025-06-30T21:35:30.000Z
Declining Grievance Resolution Performance,"Grievance resolution performance has declined from 95% to 68%, suggesting emerging tensions or conflicts between beneficiaries and project implementation, potentially linked to payment delays or benefit disputes.",medium,worsening,Percentage of grievances resolved through the GRM (Percentage) 0 Aug/2022 95 11-Oct-2024 68% 20-Jun-2025 85 Jun/2027,42c4fdb2,P177663,Implementation Status and Results Report,2025-06-30T21:35:30.000Z
Cash Transfer Payment Delays Affecting Vulnerable Populations,"Only 40% of cash transfers are being made on time, indicating systemic delays that may create hardship and social tensions among vulnerable beneficiaries dependent on timely payments.",medium,worsening,Percentage of cash transfers to beneficiary households made on time (Percentage) 0 Aug/2022 0.00 11-Oct-2024 40 20-Jun-2025 80 Jun/2027,535221f9,P177663,Implementation Status and Results Report,2025-06-30T21:35:30.000Z
Political Instability Affecting Budget Submission Timelines,"Repeated failure to meet statutory budget submission deadlines due to political instability and delayed constitution of legislative bodies, directly impacting project's core development objective of improving budget preparation.",high,persistent,"The Public Finance Management Act (PFMA) requirement for the annual budget to be submitted to the Council of Ministers by March 15 has not been adhered to... The FY24/25 budget was submitted to the Council of Ministers on 2nd August, 2024 (140 days delay)... The FY25/26 budget has not been submitted to the Council of Ministers as of May 9, 2025. This means that the deadline of March 15 has been missed.",4dfc5562,P176761,Implementation Status and Results Report,2025-06-25T15:40:08.000Z
Governance Fragility Impacting Salary Payment Predictability,"Persistent arrears in central government salary payments (10 months unpaid as of May 2025) reflect governance and fiscal fragility, undermining project's objective to improve budget implementation predictability and creating potential for civil service instability.",high,persistent,Committee for payment of salaries was formed. March to December 2024 salaries are unpaid (10 months' arrears) January 2025 to March 2025 salaries have been paid. April 2025 salaries have not been paid,31b48ae4,P176761,Implementation Status and Results Report,2025-06-25T15:40:08.000Z
Institutional Capacity Constraints from Delayed Advisor Recruitment,"Delayed procurement of critical advisors (budget, treasury, revenue policy, macro-fiscal) is hampering implementing entities' ability to finalize action plans and identify capacity needs, creating implementation delays in a fragile governance context.",high,persistent,"The delay in onboarding critical advisors to support the implementing entities, and the continued lack of minimum conditions for implementing reforms poses a risk to timely implementation of PFM reforms. The project has delayed concluding the procurement of budget; treasury; revenue policy; and macro-fiscal Advisors, posing challenges for the respective departments to finalize their action plans",833808e4,P176761,Implementation Status and Results Report,2025-06-25T15:40:08.000Z
Political Uncertainty from Electoral Processes Affecting Implementation,Elections planned for 2023 with delays in constituting Assembly and committees are expected to continue affecting budget submission timelines and institutional capacity for PFM reform implementation.,high,persistent,Elections are planned for 2023 and delays in constituting Assembly and committees are expected.,da4d0639,P176761,Implementation Status and Results Report,2025-06-25T15:40:08.000Z
Political and Governance Instability Constraining Implementation,"Political and governance fragility in South Sudan continues to pose a high risk to project implementation, affecting the ability of government institutions to execute project activities and maintain institutional capacity.",high,persistent,Political and Governance High High High,9614c735,P176900,Implementation Status and Results Report,2025-06-17T12:15:25.000Z
Macroeconomic Instability Affecting Project Viability,"Macroeconomic conditions in South Sudan remain highly unstable, creating persistent challenges for project implementation and sustainability of beneficiary livelihoods and business activities.",high,persistent,Macroeconomic High High High,3cb7b229,P176900,Implementation Status and Results Report,2025-06-17T12:15:25.000Z
Sector Strategies and Policies Fragility,"Sector-level policy instability and fragility in South Sudan continue to constrain the enabling environment for women's empowerment and GBV service delivery, rated as high risk across all review periods.",high,persistent,Sector Strategies and Policies High High High,b18c884a,P176900,Implementation Status and Results Report,2025-06-17T12:15:25.000Z
Institutional Capacity Fragility for Implementation,The implementing government institution (MGCSW) faces persistent high-risk institutional capacity constraints that affect its ability to deliver project services and sustain activities beyond project closure.,high,persistent,Institutional Capacity for Implementation and Sustainability High High High,f63d2655,P176900,Implementation Status and Results Report,2025-06-17T12:15:25.000Z
Environmental and Social Risks in Fragile Context,"Environmental and social risks remain high in South Sudan's fragile context, affecting project implementation of infrastructure and service delivery components.",high,persistent,Environment and Social High High High,1aa68129,P176900,Implementation Status and Results Report,2025-06-17T12:15:25.000Z
Political and Governance Instability Constraining Implementation,"Political and governance risks remain rated as 'High' throughout the project lifecycle, creating persistent constraints on implementation capacity and project execution in South Sudan's fragile institutional environment.",high,persistent,Risk Category: Political and Governance... Rating at Approval: High... Last Approved Rating ISR Seq. 02: High,e1796e60,P178891,Implementation Status and Results Report,2025-06-01T18:31:59.000Z
Refugee and Host Community Integration Challenges,"Project design explicitly targets refugee camps and host communities for electricity access, indicating anticipated displacement pressures and refugee populations that may complicate implementation and service delivery in Yei minigrid and health facility components.",medium,persistent,People provided with new or improved electricity service - Host communities and refugee camps (Number)... MSMEs provided with new or improved electricity service by minigrid (Number) - Comments: Number of non-residential customers in host communities and refugee camps with new or improved electricity service from the grid network in Yei,5c33a203,P178891,Implementation Status and Results Report,2025-06-01T18:31:59.000Z
Institutional Capacity Fragility in Electricity Sector,"Institutional Capacity for Implementation and Sustainability rated 'High' risk, with project dependent on strengthening Ministry of Energy and Dams and South Sudan Electricity Corporation capacity in a fragile governance context where baseline institutional performance is minimal.",high,persistent,Risk Category: Institutional Capacity for Implementation and Sustainability... Rating at Approval: High... Last Approved Rating ISR Seq. 02: High,e17ae78a,P178891,Implementation Status and Results Report,2025-06-01T18:31:59.000Z
Zero Implementation Progress Despite Project Effectiveness,"Project became effective February 28, 2024, but as of September 30, 2024, all intermediate results indicators remain at zero across grid densification, minigrid, and off-grid components, suggesting potential conflict-related access constraints or security concerns preventing on-ground implementation.",high,worsening,Households provided with new or improved electricity service by Juba grid network (Number)... Actual (Current) 0.00 30-Sep-2024... MSMEs provided with new or improved electricity service by Juba grid network (Number)... Actual (Current) 0.00 30-Sep-2024... MV lines constructed (Kilometers)... Actual (Current) 0.00 30-Sep-2024,618e0042,P178891,Implementation Status and Results Report,2025-06-01T18:31:59.000Z
Political and Governance Instability Affecting Implementation,"Political and governance risks remain persistently high, creating an ongoing constraint on project implementation in South Sudan's fragile context.",high,persistent,"Risk Category: Political and Governance - Rating at Approval: High, Last Approved Rating: High, Proposed Rating: High",05cafbbf,P169120,Implementation Status and Results Report,2025-05-31T07:01:38.000Z
Institutional Capacity Constraints in Government Implementation Partner,"Substantial institutional capacity gaps identified within the Ministry of Agriculture and Food Security, with a capacity needs assessment revealing staffing skills deficiencies at national and state levels that could impede project delivery.",high,persistent,An important capacity need assessment of MAFS staffing skills and gaps was conducted and provided a number of recommendations to enhance the technical abilities of the extension staff at the national and state level.,c442fd62,P169120,Implementation Status and Results Report,2025-05-31T07:01:38.000Z
Displacement and Refugee Pressures on Project Beneficiary Base,"Project design includes specific indicators for reaching returnees and refugees, suggesting displacement dynamics are affecting the target population and requiring crisis response mechanisms to support vulnerable displaced populations.",high,persistent,Number of returnees reached with assets and services (Number) - Comments: Returnees are farmers who were residing in the target area before and are back after being out of their country... Number of Refugees reached with assets and services (Number) - Comments: Refugee are farmers who are forced to leave their country and are currently living in the project target areas.,56ef5a72,P169120,Implementation Status and Results Report,2025-05-31T07:01:38.000Z
Crisis Response Window Activation Indicating Acute Shocks,"Significant portion of project beneficiaries (47,444 farmers) are being supported through the Crisis Response Window Emergency Response Fund, indicating acute humanitarian pressures and food insecurity crises affecting implementation areas.",high,persistent,"47,444 farmers (66% female) were supported using the Crisis Response Window Emergency Response Fund (CRW/ERF)",c1d4d26f,P169120,Implementation Status and Results Report,2025-05-31T07:01:38.000Z
Flood-Related Vulnerability and Climate-Conflict Nexus,"Project includes specific flood response interventions targeting vulnerable populations affected by flooding, indicating climate-related shocks compounding existing fragility and creating additional implementation pressures.",medium,persistent,Percentage of vulnerable populations reached with flood response interventions (percentage) - Comments: This indicator measures the number of farmers who are affected by flood and who have received inputs/equipment/training supported by the project financed by the CRW ERF funds.,d5f8db4f,P169120,Implementation Status and Results Report,2025-05-31T07:01:38.000Z
Political and Governance Instability Constraining Implementation,"High political and governance risk rating persists, affecting project decision-making and coordination across government levels. Weak GoSS oversight over the PMU is delaying critical decisions needed for project acceleration.",high,persistent,Stronger GoSS oversight over PMU would help expedite decision-making and improve coordination among key GoSS stakeholders at various levels of government.,58957240,P177093,Implementation Status and Results Report,2025-05-29T12:15:28.000Z
Institutional Capacity Gaps Limiting Sustainability Planning,"Government of South Sudan lacks established modalities for managing operations, maintenance, and defect notification periods for project infrastructure beyond the project closing date, indicating weak institutional capacity for post-project sustainability in a fragile governance context.",high,persistent,"To ensure sustainability of the project's investments, GoSS would need to develop modalities for managing and funding Operations and Maintanence (O&M) needs and Defect Notification Period (DNP) of the infrastructure falling beyond project's closing date.",5c7499dc,P177093,Implementation Status and Results Report,2025-05-29T12:15:28.000Z
Delayed Institutional Maturity Framework Affecting Governance Strengthening,"Finalization and roll-out of the Institutional Maturity Index and performance-based grant modalities are delayed, undermining the project's core objective of strengthening institutional capacity for local governance in a fragile state context.",medium,worsening,"Finalizing and roll-out of Institutional Maturity Index and developing modalities for performance-based grants to counties, and state and national level capacity needs assessment are delayed.",56d71dc7,P177093,Implementation Status and Results Report,2025-05-29T12:15:28.000Z
Refugee and Host Community Integration Challenges,"Project targets refugee-hosting counties (Pariang and Maban) with significant refugee and host community populations, requiring careful management of tensions and equitable service delivery in displacement-affected areas. No progress yet on beneficiary satisfaction indicators for these vulnerable groups.",medium,unclear,"Number of refugees who benefit from improved infrastructure due to the project in the two refugee-hosting counties (Pariang and Maban). Of these, 50% are expected to be women. Host community members that have access to improved infrastructure due to the project within the two refugee-hosting counties (Pariang and Maban).",e8b9b638,P177093,Implementation Status and Results Report,2025-05-29T12:15:28.000Z
Political and Governance Instability Constraining Implementation,"Political and governance risks remain rated as High, indicating persistent fragility in the operating environment that could affect the project's ability to maintain momentum, secure government endorsements for financial sector policies, and ensure sustained institutional commitment to central bank strengthening.",high,persistent,Political and Governance High High High,356d1091,P179278,Implementation Status and Results Report,2025-04-02T09:40:06.000Z
Macroeconomic Instability Affecting Financial Sector Operations,"Macroeconomic risks are rated High and persistent, which could undermine the viability of financial sector reforms, the stability of banking institutions being supervised, and the sustainability of infrastructure improvements being implemented.",high,persistent,Macroeconomic High High High,4996d21f,P179278,Implementation Status and Results Report,2025-04-02T09:40:06.000Z
Fiduciary Risk in High-Risk Operating Environment,"Fiduciary risks remain rated as High, reflecting concerns about financial management, procurement integrity, and accountability in a fragile governance context where political instability may compromise oversight mechanisms and create vulnerabilities to misappropriation.",high,persistent,Fiduciary High High High,f7500a42,P179278,Implementation Status and Results Report,2025-04-02T09:40:06.000Z
Political and Governance Instability Affecting Project Implementation,"Political and governance risks remain rated as High, indicating persistent fragility in the operating environment that could disrupt project implementation, particularly given South Sudan's ongoing political instability.",high,persistent,Political and Governance High High High,398bded8,P181385,Implementation Status and Results Report,2025-02-10T16:40:07.000Z
Macroeconomic Instability Impacting Project Sustainability,"Macroeconomic risks are rated High, which in South Sudan's context reflects currency volatility, inflation, and fiscal constraints that could undermine project financing and implementation capacity.",high,persistent,Macroeconomic High High High,c2680aa5,P181385,Implementation Status and Results Report,2025-02-10T16:40:07.000Z
Institutional Capacity Constraints in Fragile Context,"Institutional capacity for implementation and sustainability is rated High risk, reflecting weak government capacity to execute health sector activities in a fragile state environment.",high,persistent,Institutional Capacity for Implementation and Sustainability High High High,dc4c7050,P181385,Implementation Status and Results Report,2025-02-10T16:40:07.000Z
Refugee and Host Community Service Delivery Challenges,"Project targets refugee areas and host communities, with specific indicators for refugee health services. The FCV context creates challenges in reaching and maintaining services for displaced populations and host communities under stress.",high,persistent,Percentage of Bomas covered by the Boma Health Initiative in refugee areas. (Percentage) 16 Sep/2023 16 01-Apr-2024 16 22-Nov-2024 32 Jul/2027,01d475f3,P181385,Implementation Status and Results Report,2025-02-10T16:40:07.000Z
Stakeholder Engagement Risks in Fragile Environment,"Stakeholder risks are rated High, indicating potential tensions or coordination challenges with government and other development actors in South Sudan's fragile political context.",high,persistent,Stakeholders High High High,e86efd8b,P181385,Implementation Status and Results Report,2025-02-10T16:40:07.000Z
Flooding-Driven Food Insecurity Affecting Project Areas,"Four consecutive years of excessive flooding (2019-2023) have created acute food insecurity across South Sudan and in project implementation areas, necessitating emergency response activities under Additional Financing.",high,persistent,"An additional financing (AF) grant of US$30.5 million (including US$0.5 million from FS2030) was approved on December 4, 2023, to support the government addressing the effects of food insecurity due to four years of consecutive excessive flooding (2019-2023).",01d794ee,P169120,Aide Memoire,2025-01-16T09:50:02.000Z
Weak Government Capacity and First-Time Implementation Challenges,"Government-led implementation faces persistent challenges in timely preparation of work plans, financial management weaknesses, and lack of internal audit function, indicating fragility in institutional capacity to manage development resources.",medium,persistent,"The mission noted that the Financial Management arrangements remain effective in supporting the project's implementation, though there are challenges associated with a first-time government-led implementation. The project has yet to overcome the challenges of timely preparation and submission of Annual Work Plans and budgets (AWPBs) to the Bank for review and clearance.",65955c97,P169120,Aide Memoire,2025-01-16T09:50:02.000Z
Delayed Food Security Crisis Preparedness Plan Implementation,"A key covenant for establishing an acceptable Food Security Crisis Preparedness Plan (FSCPP) remains unfulfilled, with implementation dependent on pending Presidential Decree for the Food Reserve Agency, indicating governance delays in crisis response capacity.",medium,persistent,One key dated covenant that has not yet been fulfilled is the establishment of the Food Security Crisis Preparedness Plan (FSCPP) that is acceptable by the World Bank... It is now waiting for the presidential decree.,ea851ce4,P169120,Aide Memoire,2025-01-16T09:50:02.000Z
Inadequate Internal Controls and Financial Management Oversight,"Internal audit arrangements remain highly unsatisfactory with no internal audits conducted despite previous assurances, creating governance and fiduciary risks in a fragile state context.",high,persistent,The internal audit arrangements remain highly unsatisfactory with no internal audits carried out. Internal audit reviews are yet to be conducted despite previous assurances from the project that the internal audit will be carried out.,e92eeaf7,P169120,Aide Memoire,2025-01-16T09:50:02.000Z
Unresolved Prior Audit Findings and Non-Compliance with National Legislation,Outstanding audit report for FY2022/2023 and non-compliance with national tax legislation (Personal Income Tax withholding) indicate governance weaknesses and potential tensions with government authorities over fiscal compliance.,medium,persistent,The audit report for FY2022/2023 is still outstanding due to its unacceptability... Non-compliance to Country legislation on taxation- Personal Income Tax (PIT) on consultancy fees paid to the project's consultants not withheld and remitted to the National Revenue Authority (NRA) as required by law.,d06638b8,P169120,Aide Memoire,2025-01-16T09:50:02.000Z
