risk_title,risk_summary,severity,direction,evidence_quote,realized_risk_id,PROJ_ID_IB,doc_type,doc_date
Inadequate Environmental and Social Safeguard Staffing at Implementation Sites,"Insufficient Environmental and Social (E&S) staffing at project sites, particularly under new Additional Financing activities, creates risk of inadequate grievance management and community tensions in fragile counties.",medium,worsening,MAFS is advised to: (i) closely follow up with FAO to have adequate E&S staffing at the project sites and to continue the provision of training for Focal Points at the County levels especially on the new activities under the AF,524e0cb6,P169120,Aide Memoire,2025-01-16T09:50:02.000Z
Security Risk Assessment Gaps in New Implementation Counties,"Site-specific security risk assessments have not been completed for new counties under Additional Financing, creating implementation risks in potentially volatile areas.",medium,new,Conduct/update site-specific security risk assessment in all the new counties under the AF... Before entry to all new counties,2c00b77e,P169120,Aide Memoire,2025-01-16T09:50:02.000Z
Weak Grievance Redress Mechanism Accessibility and Transparency,"The existing Grievance Redress Mechanism lacks adequate accessibility and transparency, risking unresolved community grievances and potential tensions in project areas.",low,persistent,enhance the accessibility and transparency of the existing Grievance Redress Mechanism (GRM),1da73a71,P169120,Aide Memoire,2025-01-16T09:50:02.000Z
Delays in obtaining critical master plans and GIS data impeding project implementation,"Significant delays in securing Juba and Yei master plans and critical GIS data are persisting as major impediments to project implementation, particularly affecting Component 1 grid extension activities and Component 2 mini-grid infrastructure development.",high,persistent,"significant delays in obtaining Juba and Yei master plans, critical GIS data, and feasibility studies and as-built drawings persist as major impediments",93be287d,P178891,Aide Memoire,2025-01-07T07:35:03.000Z
Land acquisition and safeguards compliance challenges in conflict-affected context,"The project faces pressing needs for finalizing land acquisition and addressing environmental and social safeguards in a fragile state context, with risks of community tensions and non-compliance affecting Component 2 implementation in Yei.",high,persistent,The team recognized the pressing need for finalizing land acquisition and addressing safeguards to ensure compliance with both environmental and community requirements and standards,a295171e,P178891,Aide Memoire,2025-01-07T07:35:03.000Z
Governance and coordination gaps between government entities and development actors,"Implementation requires clear, coordinated approach among PIU, Ministry of Energy and Dams, and World Bank, with noted delays in government submissions and coordination challenges suggesting underlying governance fragility affecting project execution.",medium,persistent,"a clear, coordinated approach among the Project Implementation Unit (PIU), the Ministry of Energy and Dams, and the World Bank is crucial for the successful implementation of the project",a9afe5bc,P178891,Aide Memoire,2025-01-07T07:35:03.000Z
Delays in internal audit and financial accountability mechanisms in fragile governance context,"Delays in internal audits and submission of financial statements to National Audit Chamber reflect governance capacity constraints in South Sudan's fragile institutional environment, affecting project fiduciary oversight.",medium,persistent,"The mission raised concerns about delays in internal audits, and the project is required to write to the Internal Audit Directorate for the deployment of internal auditors",7ef068d8,P178891,Aide Memoire,2025-01-07T07:35:03.000Z
Refugee and displacement pressures affecting project site identification and implementation,"The presence of refugee affairs commissioners and UNHCR representatives in project meetings, combined with livelihood and economic inclusion discussions, indicates displacement and refugee pressures that may affect project site accessibility and community engagement in Yei and surrounding areas.",medium,unclear,Hon. Daniel Commissioner for Refugee Affairs CRA... Maria Kiani Senior Development Officer UNHCR... Amias Aryampa Ampurire Livelihood and Econ. Inclusion Officer UNHCR,b60f7284,P178891,Aide Memoire,2025-01-07T07:35:03.000Z
Political instability delaying legislative approval of critical PFM reforms,"Implementation and large-scale capacity building for new public procurement regulations is stalled awaiting final approval by the National Legislative Assembly, indicating political governance constraints affecting project execution.",high,persistent,Implementation and large-scale capacity building for the new public procurement regulations is awaiting their final approval by the National Legislative Assembly.,f43bbd26,P176761,Implementation Status and Results Report,2024-06-26T09:25:07.000Z
Fiscal constraints causing salary arrears affecting government operations,"Central government salary arrears have worsened from 4 months to 9 months due to fiscal constraints, undermining government capacity and potentially affecting staff morale and institutional stability.",high,worsening,"Due to fiscal constraints, new salary arrears of 9 months reported.",2e709fb2,P176761,Implementation Status and Results Report,2024-06-26T09:25:07.000Z
Electoral disruptions affecting budget submission timelines,"Elections planned for 2023 with delays in constituting Assembly and committees are expected to impact budget submission timelines, as evidenced by the FY23/24 budget submission being 36 days late.",medium,persistent,Elections are planned for 2023 and delays in constituting Assembly and committees are expected. The FY23/24 budget was submitted to the National Assembly on June 20th (36 days delay).,093397d2,P176761,Implementation Status and Results Report,2024-06-26T09:25:07.000Z
Political and Governance Instability Affecting Implementation,"Political and governance risks remain persistently high, creating ongoing constraints to project implementation in South Sudan's fragile context.",high,persistent,Political and Governance High High High,3a30bcaf,P177663,Implementation Status and Results Report,2024-05-15T00:00:00.000Z
Macroeconomic Instability Impacting Project Viability,"Macroeconomic risks remain at high level, potentially affecting the sustainability and effectiveness of cash transfer and income-generating activities.",high,persistent,Macroeconomic High High High,d0f164b5,P177663,Implementation Status and Results Report,2024-05-15T00:00:00.000Z
Institutional Capacity Constraints in Fragile Government Structures,"High institutional capacity risks persist for implementation and sustainability, reflecting challenges in government's ability to manage the safety net system in a fragile state context.",high,persistent,Institutional Capacity for Implementation and Sustainability High High High,81dfe9ce,P177663,Implementation Status and Results Report,2024-05-15T00:00:00.000Z
Refugee and Host Community Tensions in Project Areas,"Project targets both refugees and host communities in counties with high refugee concentrations, creating potential for social tensions that could affect implementation and beneficiary satisfaction.",medium,unclear,"The number of total beneficiaries HHs that are selected to receive SNSOP who are refugees, defined as forcibly displaced HHs originating from a country other than South Sudan and registered as refugees in South Sudan by the UNHCR... The number of total beneficiaries households that are selected to receive SNSOP who are from host communities, defined as local population groups living in counties with a high concentration of refugees.",55b2bdea,P177663,Implementation Status and Results Report,2024-05-15T00:00:00.000Z
Sector Strategies and Policies Instability,"High-level sector strategy and policy risks persist, indicating potential shifts in government priorities or policy frameworks affecting the social protection sector.",high,persistent,Sector Strategies and Policies High High High,e03e2002,P177663,Implementation Status and Results Report,2024-05-15T00:00:00.000Z
