risk_title,risk_summary,severity,direction,evidence_quote,realized_risk_id,PROJ_ID_IB,doc_type,doc_date
Political and Governance Instability Constraining Implementation Capacity,"Political and governance fragility in South Sudan is creating substantial constraints on project implementation, with the risk category rated as 'High' and persisting across multiple reporting periods. This affects the government's ability to execute project activities and maintain institutional continuity.",high,persistent,"Political and Governance [Risk Category Rating]: Substantial [at Approval], High [Last Approved Rating ISR Seq. 04], High [Proposed Rating]",81dbcb85,P178654,Implementation Status and Results Report,2025-10-31T06:55:36.000Z
Macroeconomic Instability Affecting Project Sustainability,"Macroeconomic risks have escalated from 'Substantial' at project approval to 'High' in current ratings, indicating worsening economic conditions that threaten project implementation and sustainability in South Sudan's fragile context.",high,worsening,"Macroeconomic [Risk Category Rating]: Substantial [at Approval], High [Last Approved Rating ISR Seq. 04], High [Proposed Rating]",fde6522a,P178654,Implementation Status and Results Report,2025-10-31T06:55:36.000Z
Institutional Capacity Constraints Amid Governance Fragility,"Institutional capacity for implementation and sustainability has deteriorated from 'Substantial' at approval to 'High' risk, reflecting challenges in government ministries' ability to execute project activities in a fragile governance environment.",high,worsening,"Institutional Capacity for Implementation and Sustainability [Risk Category Rating]: Substantial [at Approval], High [Last Approved Rating ISR Seq. 04], High [Proposed Rating]",4f33556e,P178654,Implementation Status and Results Report,2025-10-31T06:55:36.000Z
Refugee and Host Community Integration Amid Displacement Pressures,"The project's expansion to include refugee and host community education (Component 3) reflects underlying displacement pressures in South Sudan. The development objective was modified to explicitly address refugee access to education, indicating this is an emerging FCV-related implementation challenge.",high,new,"Current Development Objective (Approved as part of Additional Financing package Seq. 1 on 11-Sep-2024): The Project's Development Objective is to increase skills development opportunities in teaching and digital agriculture, improve access to education for refugee and host community children and strengthen capacity for management of the education system.",8f8b749e,P178654,Implementation Status and Results Report,2025-10-31T06:55:36.000Z
Delayed Implementation in Refugee-Hosting Areas Due to Operational Challenges,"Component 3 activities targeting 200 schools in refugee-hosting areas remain in preparatory phases with no actual rehabilitation or re-operationalization commenced as of September 2025. This delay reflects implementation challenges in operating within fragile, displacement-affected contexts.",medium,persistent,"MoGEI has completed the identification of the 200 schools that will benefit from this project activity, with contracting for rehabilitation works anticipated to commence within the next six months.",c9c82cb0,P178654,Implementation Status and Results Report,2025-10-31T06:55:36.000Z
Political and Governance Instability Constraining Implementation Capacity,"Political and governance fragility in South Sudan is creating substantial constraints on project implementation, with the risk category rated as 'High' and persistent across reporting periods. This affects the government's ability to execute project activities and maintain institutional continuity.",high,persistent,"Political and Governance [Risk Category Rating]: Substantial [at Approval], High [Last Approved Rating ISR Seq. 04], High [Proposed Rating]",9622f96d,P178654,Implementation Status and Results Report,2025-10-31T06:55:07.000Z
Macroeconomic Instability Affecting Project Sustainability,"Macroeconomic fragility in South Sudan has escalated from 'Substantial' at project approval to 'High' risk rating, creating persistent challenges for project implementation and the sustainability of government commitments to education sector investments.",high,worsening,"Macroeconomic [Risk Category Rating]: Substantial [at Approval], High [Last Approved Rating ISR Seq. 04], High [Proposed Rating]",a730d6c0,P178654,Implementation Status and Results Report,2025-10-31T06:55:07.000Z
Institutional Capacity Constraints Linked to Governance Fragility,"Institutional capacity for implementation and sustainability has deteriorated from 'Substantial' at approval to 'High' risk, reflecting governance-related constraints on the government's ability to execute project activities, manage finances, and sustain reforms in the education sector.",high,worsening,"Institutional Capacity for Implementation and Sustainability [Risk Category Rating]: Substantial [at Approval], High [Last Approved Rating ISR Seq. 04], High [Proposed Rating]",746954c2,P178654,Implementation Status and Results Report,2025-10-31T06:55:07.000Z
Refugee and Host Community Inclusion Dependent on Fragile Operating Environment,"The project's expanded focus on refugee and host community education (Component 3, added in Additional Financing September 2024) is being implemented in a fragile context where displacement pressures and refugee hosting dynamics create implementation risks. The development objective was modified to include 'improve access to education for refugee and host community children,' indicating recognition of FCV-related pressures.",high,new,"Current Development Objective (Approved as part of Additional Financing package Seq. 1 on 11-Sep-2024): The Project's Development Objective is to increase skills development opportunities in teaching and digital agriculture, improve access to education for refugee and host community children and strengthen capacity for management of the education system.",cced364f,P178654,Implementation Status and Results Report,2025-10-31T06:55:07.000Z
Political and Governance Instability Constraining Implementation,"Political and governance fragility in South Sudan continues to pose a high risk to project implementation, affecting the ability to deliver services and strengthen government capacity across all components.",high,persistent,Political and Governance High High High,941cab3b,P176900,Implementation Status and Results Report,2025-10-24T10:15:15.000Z
Macroeconomic Instability Affecting Project Viability,"Macroeconomic risks remain high and persistent, potentially undermining the sustainability of women's entrepreneurial activities and livelihood services supported by the project.",high,persistent,Macroeconomic High High High,9350dbe1,P176900,Implementation Status and Results Report,2025-10-24T10:15:15.000Z
Sector Strategies and Policies Instability,High-risk sector strategies and policies environment continues to affect the project's ability to implement women's empowerment and GBV services in a stable policy framework.,high,persistent,Sector Strategies and Policies High High High,977242c9,P176900,Implementation Status and Results Report,2025-10-24T10:15:15.000Z
Institutional Capacity Fragility for Implementation,"Institutional capacity for implementation and sustainability remains high-risk, reflecting the fragility of government institutions (MGCSW) to effectively deliver and sustain women's empowerment and GBV services.",high,persistent,Institutional Capacity for Implementation and Sustainability High High High,ea04c23a,P176900,Implementation Status and Results Report,2025-10-24T10:15:15.000Z
High Political and Governance Risk Rating,"The project operates in South Sudan under a High political and governance risk rating, which directly affects implementation capacity and stakeholder engagement in a fragile state context.",high,persistent,Political and Governance High High,fab937b7,P500553,Implementation Status and Results Report,2025-09-11T14:55:21.000Z
High Institutional Capacity Risk in Fragile Context,"Institutional capacity for implementation and sustainability is rated High risk, indicating significant challenges in executing project activities through government and local institutions in a fragile state.",high,persistent,Institutional Capacity for Implementation and Sustainability High High,75c19649,P500553,Implementation Status and Results Report,2025-09-11T14:55:21.000Z
High Environment and Social Risk,"The project faces High environment and social risks, which in South Sudan's FCV context may include tensions over resource access, displacement pressures, and community conflicts related to rangeland and water management.",high,persistent,Environment and Social High High,38120885,P500553,Implementation Status and Results Report,2025-09-11T14:55:21.000Z
Overall High Risk Rating in Fragile State,"The project maintains an overall High risk rating, reflecting the cumulative FCV-related challenges of implementing a livestock sector project in South Sudan's fragile and conflict-affected environment.",high,persistent,Overall Risk Rating High,e0532c7e,P500553,Implementation Status and Results Report,2025-09-11T14:55:21.000Z
Security constraints affecting hydromet site assessments and infrastructure development,"Security risk assessments are required for hydromet stations before construction can proceed. The contract for a dedicated Security Risk Management Firm was not yet signed as of the mission (expected July 30, 2025), potentially delaying site assessments and the January 2026 start of hydromet station construction.",medium,persistent,"Hydrological, environmental, and social (E&S) screening including security risk assessments of selected hydromet sites is in progress... The contract signing with Security Risk Management Firm is expected to be on July 30, 2025.",72c96733,P500441,Aide Memoire,2025-09-05T12:55:03.000Z
Operational and maintenance challenges in conflict-affected areas limiting WASH sustainability,"Field visits to refugee settlements and rural areas revealed significant challenges in operating and maintaining WASH systems, including vandalism, water quality issues, and limited repair capacity. These challenges are compounded by the fragile context and may undermine project sustainability in refugee-hosting and rural communities.",medium,persistent,"Discussions during the visit highlighted several challenges related to the operation and maintenance of these systems, including vandalism, water quality issues, limited repair capacity, and a lack of standardization in design.",2906d082,P500441,Aide Memoire,2025-09-05T12:55:03.000Z
"Coordination gaps between government, humanitarian, and development actors in refugee-hosting areas","Stakeholder mapping under the CIWA Trust Fund identified critical coordination gaps among government, humanitarian, and development actors in refugee-hosting areas (Maban, Jamjang, Aweil West). These gaps could undermine project effectiveness and create implementation bottlenecks.",medium,persistent,"The team presented the preliminary results of the stakeholder mapping, which identified critical coordination gaps among government, humanitarian, and development actors.",3dd68b8e,P500441,Aide Memoire,2025-09-05T12:55:03.000Z
Institutional capacity constraints in fragile government structures affecting project implementation,"The project relies on government-led implementation through MWRI, which operates in a fragile institutional environment. Significant gaps in accounting capacity, delays in financial transaction recording, and the need to hire additional specialized staff (Finance Officer, E&S specialists) indicate underlying institutional fragility that could affect project delivery.",medium,persistent,Gaps were also noted in the accounting capacity. The mission recommends the MRI/PIU to hire a Finance Officer for the project to improve the accounting capacity... The mission also advises the MWRI to timely share the action plan with the Bank's safeguard colleagues including progress and pending activities.,a5d01e83,P500441,Aide Memoire,2025-09-05T12:55:03.000Z
FCV context training for implementing firms not yet completed,"FCV context and security training for firms' staff prior to field missions was marked as 'In progress' from the previous mission (due January 31, 2025). Delayed completion of this training could expose implementing partners to security risks and compromise their ability to operate safely in conflict-affected areas.",medium,persistent,"FCV context and Security training for Firms' staff prior to field missions Firms/PIU guidance January 31, 2025 In progress",01e2768a,P500441,Aide Memoire,2025-09-05T12:55:03.000Z
Refugee and host community tensions requiring careful implementation modality design,"The National WASH project targets both refugee and host communities. The mission discussions with UNHCR and CRA focused on transitioning from humanitarian/emergency approaches to development-focused service provision, indicating underlying tensions and the need for careful implementation modalities to avoid exacerbating community relations.",medium,persistent,MWRI was particularly interested in understanding UNHCR's experience in WASH and their perspective on transitioning from a humanitarian/emergency approach to a development-focused provision of services.,b100ab31,P500441,Aide Memoire,2025-09-05T12:55:03.000Z
Security constraints limiting hydromet site assessments and infrastructure development,"Security risk assessments are required across hydromet sites before construction can proceed. The contract for a dedicated Security Risk Management Firm was not yet signed as of the mission (expected July 30, 2025), potentially delaying the start of hydromet station construction planned for January 2026.",medium,persistent,"Hydrological, environmental, and social (E&S) screening including security risk assessments of selected hydromet sites is in progress... The contract signing with Security Risk Management Firm is expected to be on July 30, 2025.",36ec8e85,P180611,Aide Memoire,2025-09-05T12:55:03.000Z
Operational and maintenance challenges in conflict-affected areas limiting WASH sustainability,"Field visits to refugee settlements and rural areas revealed significant challenges in operating and maintaining WASH systems, including vandalism, water quality issues, and limited repair capacity. These challenges are particularly acute in displacement-affected communities and may undermine project sustainability.",medium,persistent,"Discussions during the visit highlighted several challenges related to the operation and maintenance of these systems, including vandalism, water quality issues, limited repair capacity, and a lack of standardization in design.",9c9aa347,P180611,Aide Memoire,2025-09-05T12:55:03.000Z
"Coordination gaps between government, humanitarian, and development actors in refugee-hosting areas","Stakeholder mapping under the CIWA Trust Fund identified critical coordination gaps among government, humanitarian, and development actors in refugee-hosting areas (Maban, Jamjang, Aweil West). These gaps may impede effective project implementation and service delivery in displacement-affected communities.",medium,persistent,"The team presented the preliminary results of the stakeholder mapping, which identified critical coordination gaps among government, humanitarian, and development actors.",712ef5ef,P180611,Aide Memoire,2025-09-05T12:55:03.000Z
Institutional capacity constraints in fragile government structures affecting project implementation,"The project relies on MWRI institutional capacity in a fragile governance context. Multiple staffing gaps remain (hydrologist recruitment ongoing, E&S staff recruitment needed by September 2025, Finance Officer hiring required), and the PIU office construction is still ongoing, potentially constraining implementation pace.",medium,persistent,"Recruitment of a hydrologist for the PIU is still in progress and expected to be completed in July 2025... the mission highlighted the necessity of sufficient E&S staff capacity for project preparation and implementation, particularly the hiring of a GBV specialist, social development officer, and environmental officer.",979afc29,P180611,Aide Memoire,2025-09-05T12:55:03.000Z
FCV context requiring specialized security training for implementing firms,"The project operates in a fragile and conflict-affected context requiring FCV-specific security training for firms' staff prior to field missions. This training was noted as 'in progress' as of the mission, indicating ongoing security management needs.",medium,persistent,"FCV context and Security training for Firms' staff prior to field missions Firms/PIU guidance January 31, 2025 In progress",79b9ac0a,P180611,Aide Memoire,2025-09-05T12:55:03.000Z
Implementation challenges in refugee-hosting and displacement-affected communities,"The National WASH project explicitly targets refugee and host communities, requiring hybrid implementation models involving UN agencies and NGOs. The project must navigate complex operational environments in displacement-affected areas with limited government capacity.",medium,persistent,"One potential option, which MWRI agreed to consider, involves a hybrid implementation model. This model would entail MWRI forming contractual or Memorandum of Understanding (MoU) agreements with UN agencies, NGOs, and companies within the WASH sector to carry out specific interventions in designated areas, such as rural regions and communities hosting refugees.",dba03022,P180611,Aide Memoire,2025-09-05T12:55:03.000Z
Security-Related Disruptions to Pharmaceutical Supply Chain,"Security forces interference, roadblocks, attempted looting, and threats to vendors are causing delays in pharmaceutical supply delivery and distribution across project areas.",high,persistent,"Security-related disruptions were a major concern, including interference by security forces, roadblocks, attempted looting, and threats to vendors, all of which posed risks to personnel and delayed operations.",52cec011,P181385,Aide Memoire,2025-08-22T14:05:03.000Z
Healthcare Facility Closures Due to Ongoing Conflict,"At least 20 HSTP-supported health facilities remain closed due to ongoing security challenges, with recent aerial bombardment in New Fangak causing facility closures and population displacement.",high,persistent,"The conflict impact tracker report indicated that about 37 healthcare facilities supported by HSTP, including the recent aerial bombardment in New Fangak in Jonglei State, faced population displacement and resulted in the closure of New Fangak Hospital and Pakan PHCC on May 15, 2025. However, at least 20 facilities remain closed due to ongoing security challenges.",03f80981,P181385,Aide Memoire,2025-08-22T14:05:03.000Z
Unresolved Supply Deliveries in Insecure Areas,"Pending pharmaceutical deliveries for Cycle 3 in Nasir, Ulang, and Kajo-Keji counties remain unresolved due to ongoing insecurity, creating risk of supply expiry and wastage.",high,persistent,"Pending deliveries for Cycle 3 in Nasir, Ulang, and Kajo-Keji counties remain unresolved due to ongoing insecurity in those areas, highlighting the need for stronger coordination, data systems, and risk mitigation strategies.",70e42ba8,P181385,Aide Memoire,2025-08-22T14:05:03.000Z
Movement Restrictions Impeding E&S Monitoring,Security and access limitations are preventing regular Environmental and Social monitoring and reporting activities across project implementation areas.,high,persistent,Movement restrictions: security and access limitations impeded regular E&S monitoring and reporting.,56eb1fb4,P181385,Aide Memoire,2025-08-22T14:05:03.000Z
Staff Safety and Service Delivery Disruption in Conflict-Affected States,Current conflict and instability in Upper Nile State and Western Equatoria State are affecting staff safety and disrupting delivery of healthcare and other essential services.,high,persistent,"The current conflict and instability in UNS and WES are affecting staff safety and disrupting the delivery of services, including healthcare and other essential services.",81468fcd,P181385,Aide Memoire,2025-08-22T14:05:03.000Z
Attrition of Boma Health Workers Due to Governance Instability,"Attrition among Boma Health Workers is exacerbated by frequent staff changes within County Health Departments, indicating governance fragility at local level.",medium,persistent,Attrition among Boma Health Workers (BHWs) is exacerbated by frequent staff changes within County Health Departments (CHDs).,df3335f9,P181385,Aide Memoire,2025-08-22T14:05:03.000Z
Weak BHI Governance and Oversight at Local Levels,Weak governance of the Boma Health Initiative at boma level by Boma Health Committees due to lack of incentivization reflects governance fragility affecting program operations.,medium,persistent,"Weak BHI governance, insufficient support, and inadequate oversight from national to local levels affect BHI operations. For instance, the governance of BHI at the boma level by the Boma Health Committees (BHCs) is weak due to lack of incentivization.",c5e01fe1,P181385,Aide Memoire,2025-08-22T14:05:03.000Z
Delayed Incentive Payments Affecting Health Worker Motivation,"Delays in providing incentives to Boma Health Workers and healthcare workers are demotivating factors affecting their commitment and service delivery, with potential for staff attrition.",medium,persistent,"The delay in providing incentives to BHWs is a demotivating factor in their commitment. Delayed incentive payments, low routine immunization (RI) coverage, and poor uptake of the malaria vaccine—driven by social norms and maternal hesitancy—have contributed to multiple vaccine-preventable disease outbreaks.",1f158c24,P181385,Aide Memoire,2025-08-22T14:05:03.000Z
Government Budget Execution Constraints Affecting Project Implementation,"The percentage of Ministry of Health budget executed remains constrained at 31% against a 50% Year 1 target, indicating government financing fragility affecting project sustainability.",medium,persistent,The PDO indicator on 'Percentage of MoH budget executed' is lagging.,54739eca,P181385,Aide Memoire,2025-08-22T14:05:03.000Z
Financing Disruptions Affecting HSTP Health Facilities,"There is lack of information on the effect of financing disruptions specifically on HSTP health facilities, indicating potential government capacity or commitment issues.",medium,unclear,There is a lack of information on the effect of the financing disruptions specifically on HSTP health facilities.,e5212544,P181385,Aide Memoire,2025-08-22T14:05:03.000Z
Overdue Government Co-Financing Commitment,"The Government of South Sudan's direct co-financing commitment of US$4 million to HSTP was due in October 2024 and remains overdue, indicating government financing fragility.",medium,persistent,"The Government of the Republic of South Sudan direct co-financing commitment to HSTP of US$4 million was due in October 2024, and is now overdue.",c00cf1c1,P181385,Aide Memoire,2025-08-22T14:05:03.000Z
Political and Governance Instability Affecting Project Implementation,"Political and governance fragility in South Sudan continues to constrain project implementation, with the risk rating remaining at 'High' across approval and current periods. This affects coordination capacity and institutional stability needed for health sector transformation.",high,persistent,Political and Governance High High High,844968d8,P181385,Implementation Status and Results Report,2025-08-19T09:50:08.000Z
Macroeconomic Instability Impacting Project Sustainability,"Macroeconomic risks remain at 'High' level, creating challenges for sustained financing and implementation of health sector activities. This affects the project's ability to maintain service delivery and institutional capacity.",high,persistent,Macroeconomic High High High,bf58865e,P181385,Implementation Status and Results Report,2025-08-19T09:50:08.000Z
Institutional Capacity Constraints in Conflict-Affected Context,"Institutional capacity for implementation and sustainability is rated 'High' risk, reflecting fragility in government structures and coordination mechanisms needed to execute health sector transformation in a conflict-affected environment.",high,persistent,Institutional Capacity for Implementation and Sustainability High High High,12cca1df,P181385,Implementation Status and Results Report,2025-08-19T09:50:08.000Z
Coordination Challenges Between Government and Development Partners,"The project identifies a need to strengthen coordination on pharmaceutical supply chain management, suggesting tensions or capacity gaps in government-development actor coordination that may reflect governance fragility.",medium,persistent,there is a need to strengthen coordination on pharmaceutical supply chain management and climate-resilient rehabilitation planning,f210c99d,P181385,Implementation Status and Results Report,2025-08-19T09:50:08.000Z
Data Verification Gaps in Refugee and Host Community Areas,"Multiple critical health indicators show 'Data not available - pending TPM agencies onboarding' in refugee areas and host communities, indicating implementation challenges in accessing or verifying results in displacement-affected zones, which may reflect security or access constraints.",medium,persistent,Data not available - pending TPM agencies onboarding,eb49b234,P181385,Implementation Status and Results Report,2025-08-19T09:50:08.000Z
