risk_title,risk_summary,severity,direction,evidence_quote,realized_risk_id,PROJ_ID_IB,doc_type,doc_date
Refugee-Specific Service Delivery Disparities,"Significant performance gaps exist between refugee and host community areas. For example, only 16% of refugee women received four ANC visits compared to 26% in host communities, suggesting implementation challenges in refugee settings that may be conflict or displacement-related.",medium,persistent,Percentage of refugee women receiving four ANC visits (Percentage) 20 Aug/2023 20 01-Apr-2024 16 27-May-2025 52 Jun/2027,06d58856,P181385,Implementation Status and Results Report,2025-08-19T09:50:08.000Z
Government Counterpart Funding Commitment Uncertainty,"The Government of South Sudan has not yet deposited the required US$3 million counterpart funding into the project account, with the deadline approaching (June 11, 2025). This suggests potential fragility in government commitment to the project and capacity constraints within the Ministry of Finance.",medium,persistent,"The legal covenant on depositing US$3 million into the counterpart fund account not later than 180 days after effectiveness is yet to be achieved. The Government has been advised to open the counterpart fund account for BIFEPS and the MoPSHRD will be following up with the Ministry of Finance on the deposit of the funds prior to the June 11, 2025, deadline.",71256984,P500500,Aide Memoire,2025-08-01T10:55:03.000Z
Weak Institutional Capacity and Governance Fragility in Public Service,"The project targets civil service reform in a fragile state context. The need to build institutional capacity from within the civil service, including recruiting environmental and social specialists and training them, indicates underlying governance fragility and limited existing institutional expertise to manage development projects.",medium,persistent,"The covenant on recruiting an environmental and social specialist is underway to be achieved following the mission's agreement that to align with the objectives of the Program to strengthen institutional and human resource capabilities, qualified specialists will be identified from within the civil service and subjected to rigorous training both by the Bank and externally, to facilitate the initiation of building a pool of environmental and social risk management experts.",4fdd4e62,P500500,Aide Memoire,2025-08-01T10:55:03.000Z
Substantial Financial Management Risk Rating,"The project carries a 'Substantial' FM risk rating, which in a fragile state context indicates concerns about government capacity to manage project finances, potential governance issues, and vulnerability to mismanagement or diversion of funds.",high,persistent,Financial Management and Disbursements: The project's FM risk rating is 'Substantial'. The mission agreed that a draft Financial Management manual would be submitted by the PMU by end-April 2025.,e38ca547,P500500,Aide Memoire,2025-08-01T10:55:03.000Z
Delayed Establishment of Grievance Mechanism,"The Grievance Mechanism, critical for addressing stakeholder concerns and tensions in a fragile context, has not yet been established despite the project becoming effective in December 2024. This delays the project's ability to respond to emerging conflicts or grievances from affected populations.",medium,persistent,"An Environmental and Social Development Specialist will be assigned from the civil service to support the Project, and a Grievance Mechanism should be established prior to start of implementation of the project activities. The PMU should fast track the deployment of the E&S staff and submit the Grievance Mechanism to the Bank for review.",4ae5cf0e,P500500,Aide Memoire,2025-08-01T10:55:03.000Z
Political and Governance Instability Affecting Project Implementation,"The project operates in South Sudan under persistently high political and governance risk, which constrains the government's capacity to implement civil service reforms and maintain institutional continuity for project activities.",high,persistent,Political and Governance High High High,96167657,P500500,Implementation Status and Results Report,2025-07-31T22:55:08.000Z
Institutional Capacity Fragility Limiting Reform Implementation,"High institutional capacity risk persists, indicating that government institutions lack the stability and capability to sustain civil service reforms, functional reviews, and competency-based HRM framework implementation required by the project.",high,persistent,Institutional Capacity for Implementation and Sustainability High High High,895ef2a0,P500500,Implementation Status and Results Report,2025-07-31T22:55:08.000Z
Stakeholder Tensions and Resistance to Civil Service Reforms,"High stakeholder risk is flagged, suggesting potential resistance from public servant unions, civil society organizations, and other stakeholders to the civil service reforms, pay restructuring, and pension fund changes being implemented.",high,persistent,Stakeholders High High High,5b68af9f,P500500,Implementation Status and Results Report,2025-07-31T22:55:08.000Z
Macroeconomic Instability Threatening Project Sustainability,"Persistent high macroeconomic risk in South Sudan may undermine the government's ability to sustain pension fund reforms, civil servant incentives, and reform champion compensation mechanisms required for project success.",high,persistent,Macroeconomic High High High,04849551,P500500,Implementation Status and Results Report,2025-07-31T22:55:08.000Z
High Political and Governance Risk Persisting,"Political and governance risk remains rated as 'High' at both approval and current ISR review, indicating ongoing political instability or governance fragility affecting the operating environment for financial sector strengthening activities.",high,persistent,"Political and Governance [Risk Category]: High [Rating at Approval - 28 Sep 2023], High [ISR Seq. 01 - 09 Jan 2024], High [Proposed Rating]",820b74f6,P179278,Implementation Status and Results Report,2025-07-29T21:21:55.000Z
High Macroeconomic Risk Affecting Project Sustainability,"Macroeconomic risk is rated 'High' across all review periods, suggesting severe economic instability or currency/inflation pressures that could undermine the viability of financial sector reforms and institutional strengthening efforts.",high,persistent,"Macroeconomic [Risk Category]: High [Rating at Approval - 28 Sep 2023], High [ISR Seq. 01 - 09 Jan 2024], High [Proposed Rating]",dca63dc1,P179278,Implementation Status and Results Report,2025-07-29T21:21:55.000Z
High Fiduciary Risk at Project Approval,"Fiduciary risk was rated 'High' at project approval, indicating concerns about financial management, procurement, or governance capacity within implementing agencies that could be exacerbated by fragility conditions.",high,improving,"Fiduciary [Risk Category]: High [Rating at Approval - 28 Sep 2023], Low [ISR Seq. 01 - 09 Jan 2024], Low [Proposed Rating]",4c4b2b1f,P179278,Implementation Status and Results Report,2025-07-29T21:21:55.000Z
Government Capacity Constraints and Institutional Fragility in Project Execution,"The Ministry of Agriculture and Food Security (MAFS) has demonstrated persistent weak institutional capacity affecting project implementation, with internal fiduciary controls showing no improvement since the last supervision mission and audit findings of ineligible expenditures.",medium,persistent,"At the project design stage, the ministry's capacity was noted as being very weak. The assessment report identified the ministry's capacity gaps and made recommendations for MAFS capacity building, which the project will support for the next 12 months.",9c6db217,P169120,Aide Memoire,2025-07-18T06:55:07.000Z
Delayed Government Endorsement of Critical Food Security Policy Framework,"The Food Security Crisis Preparedness Plan (FSCPP), a key covenant requirement, remains pending presidential decree approval despite Council of Ministers approval, creating uncertainty in the government's institutional readiness to implement food security mechanisms.",medium,persistent,One key dated covenant that has not yet been fulfilled is the establishment of the Food Security Crisis Preparedness Plan (FSCPP) acceptable to the World Bank... The Bank is waiting for the final endorsement of the Plan by the President's office.,4f451839,P169120,Aide Memoire,2025-07-18T06:55:07.000Z
Loss of Project Funds Due to Government Administrative Failure,"The government failed to request an extension of the FS2030 Trust Fund before its closing date, resulting in loss of US$0.5 million in project resources and requiring refund of US$250,000 in unutilized advances.",medium,worsening,"Under the AF, the project lost US$0.5 million due to the government inability to request an extension of the TF before its closing date. As a result, the project is required to refund US$250,000 that has been advanced to the designated account but remained unutilized.",1638d77e,P169120,Aide Memoire,2025-07-18T06:55:07.000Z
Weak Project Management and Oversight Systems,"The Single Project Coordination Unit (SPCU) demonstrates systemic weaknesses in field mission management, financial oversight, and third-party monitoring quality, with ad hoc rather than structured planning affecting implementation effectiveness.",medium,persistent,The SPCU has shown weaknesses in managing Field missions and overseas training. Field trips are often conducted without clear terms of reference and the resulting back-to-office reports lack sufficient detail... the quality of this first report was not acceptable and SPCU was advised to carefully review the accuracy and completeness of the information before submitting it to the World Bank.,4e9decea,P169120,Aide Memoire,2025-07-18T06:55:07.000Z
Unresolved Audit Findings and Financial Management Deficiencies,"The 2023/2024 annual audit identified ineligible expenditures of US$13,700 requiring reimbursement, and internal fiduciary control systems continue to show several weaknesses with no improvement since the last supervision mission.",medium,persistent,"Internal fiduciary control systems still show several weaknesses, indicating that it has not improved since the last supervision mission. The 2023/2024 annual audit uncovered ineligible expenditures amounting to US$13,700. As recommended by the audit report, this amount needs to be reimbursed to the World Bank no later than July 15, 2025.",5f3b514c,P169120,Aide Memoire,2025-07-18T06:55:07.000Z
Political and Governance Instability Affecting Project Operations,"Political and governance risks remain rated as High, indicating persistent fragility in the operating environment that could disrupt project implementation despite current satisfactory progress.",high,persistent,Political and Governance High High High,2dee49d2,P169120,Implementation Status and Results Report,2025-07-17T16:35:07.000Z
Macroeconomic Instability Impacting Project Sustainability,"Macroeconomic risks are rated High across all assessment periods, suggesting ongoing economic fragility that may affect farmer livelihoods, input availability, and project sustainability.",high,persistent,Macroeconomic High High High,bc434b55,P169120,Implementation Status and Results Report,2025-07-17T16:35:07.000Z
Displacement and Refugee Integration Pressures,"The project is actively reaching displaced populations (11,811 returnees and 830 refugees with assets and services), indicating ongoing displacement dynamics that create implementation pressures and require targeted support.",medium,persistent,"Under the AF, 11,811 returnees were reached with assets and services while 830 refugees were reached with the same inputs.",c94afa7b,P169120,Implementation Status and Results Report,2025-07-17T16:35:07.000Z
Institutional Capacity Deterioration for Implementation and Sustainability,"Institutional capacity for implementation and sustainability has declined from Substantial to Moderate in the latest assessment, suggesting weakening government and partner capacity to sustain project gains.",medium,worsening,Institutional Capacity for Implementation and Sustainability High Substantial Moderate,6f28cc6b,P169120,Implementation Status and Results Report,2025-07-17T16:35:07.000Z
Governance Fragility and Institutional Capacity Collapse in Project Implementation,"Systemic failure of the Owner's Engineer (OE) contractor, including fraudulent misrepresentation of key experts, breach of contract, and potential double-billing on other World Bank projects, indicates severe governance and institutional weakness affecting project delivery. The PIU's limited capacity to enforce contractual compliance threatens project viability.",high,worsening,"During the mission, the OE's ""key experts"" admitted they had no insight into the Conceptual Design report and disclosed that their names were used in the proposal, but they were never assigned to the actual work. This is not only a critical absence of leadership and engagement but a serious breach of contract and potential fraud... Additionally, there is growing evidence that key experts are being double presented on other active World Bank projects, which, if confirmed, could constitute fraudulent misrepresentation under Bank procurement policy.",674e5daf,P178891,Aide Memoire,2025-07-11T06:35:02.000Z
Conflict Over Project Scope and Contractor Selection Between Government Entities,Ongoing dispute between Juba Electricity Distribution Company (JEDCO) and Ministry of Energy and Dams (MoED) over payment obligations and contractor selection for service drop connections creates institutional tension and threatens procurement timelines. JEDCO's insistence on being contracted despite World Bank position creates governance friction.,medium,persistent,"The mission noted with concern that there is still an ongoing discussion between Juba Electricity Distribution Company (JEDCO) and the MoED over payment request from JEDCO for investments made against the 24 transformers installed by the African Development Bank funded project, and JEDCO insistence on being contracted to implement the service drop connections.",4f74fa43,P178891,Aide Memoire,2025-07-11T06:35:02.000Z
Weak Financial Controls and Fiduciary Integrity Undermining Project Credibility,"Multiple instances of ineligible expenditures, asset theft, unauthorized payments, and weak internal controls indicate systemic fiduciary weakness. Qualified audit opinion and evidence of staff misconduct (cashing PIT cheques, double-charged accommodation, stolen assets) suggest governance fragility affecting stakeholder confidence in government institutions managing development funds.",high,persistent,"The latest FM assessment mission identified significant weaknesses in internal controls, including: (i) Weak internal controls and lack of internal audit reviews; (ii) Ineligible expenditures, such as cashing Personal Income Tax (PIT) cheques, double-charged accommodation, and payment for internet services not received; (iii) Inadequate project asset management, including loss or theft of assets... (viii) Supplier payments are made via petty cash; and (ix) Stolen project assets.",51393116,P178891,Aide Memoire,2025-07-11T06:35:02.000Z
Inadequate Environmental and Social Safeguards in Conflict-Affected Regions,"Gaps in grievance redress mechanism functionality, absence of resettlement plans for affected populations, and weak E&S focal person deployment in project areas (Juba, Yei, Upper Nile Region) create risk of unaddressed community grievances and potential social tensions. Incomplete land acquisition documentation raises concerns about voluntary consent in fragile context.",medium,persistent,"The following gaps were identified: (i) E&S focal persons were not assigned in Juba and Yei towns; (ii) a resettlement plan (RP) was not prepared for the relocation of PAPs for the construction of the solar PV plant in Yei; (iii) the functionality of the GRM is weak as the short code is not yet popularized or socialized to the PAPs and other stakeholders, including lack of establishment of GRC in Juba and Yei",36591d92,P178891,Aide Memoire,2025-07-11T06:35:02.000Z
Tension Between Development Actor (World Bank) and Government Over Procurement Integrity,"World Bank's explicit directive to MoED to proceed with procurement outside JEDCO's involvement, combined with concerns about OE's procurement integrity (submitting RFB documentation based on flawed, unoptimized designs), indicates friction between development partner and government on project governance standards.",medium,persistent,"The Bank team reiterated the position that the World Bank funds shall neither be used to pay JEDCO for any investments incurred, nor to contract JEDCO for any part of the project. The Bank team advised MoED to proceed to procure a contractor for the service drop connections... Despite this, the OE proceeded to submit Request for Bids (RFB) documentation, raising serious concerns about procurement integrity and financial misalignment.",c94f1c4e,P178891,Aide Memoire,2025-07-11T06:35:02.000Z
Political and Governance Instability Constraining Project Implementation,"South Sudan's persistent political and governance fragility is rated as 'High' risk at approval and remains 'High' in the current assessment, directly affecting the project's ability to implement energy infrastructure and institutional strengthening activities.",high,persistent,Political and Governance High High High,319491b5,P178891,Implementation Status and Results Report,2025-07-10T16:40:14.000Z
Institutional Capacity Fragility Impeding Implementation Progress,"The project faces 'High' institutional capacity risks for implementation and sustainability, which is persistent from approval through the current period. This directly impacts the ability of MoED and SSEC to execute project activities and maintain infrastructure.",high,persistent,Institutional Capacity for Implementation and Sustainability High High High,25dfb0cb,P178891,Implementation Status and Results Report,2025-07-10T16:40:14.000Z
Zero Implementation Progress on Core Electricity Access Targets,"As of September 30, 2024, the project has achieved zero actual results on all PDO indicators measuring people provided with electricity services, despite being effective since February 2024. This suggests severe implementation constraints, likely linked to the FCV context.",high,worsening,"People provided with new or improved electricity service (Number) 0.00 Jan/2023 0 30-Sep-2024 0 30-Sep-2024 340,000.00 Jan/2028",5b13bf23,P178891,Implementation Status and Results Report,2025-07-10T16:40:14.000Z
Deteriorating Overall Implementation Progress Rating,"The Overall Implementation Progress rating has declined from 'Moderately Satisfactory' to 'Moderately Unsatisfactory' in the current period, indicating worsening project execution conditions likely exacerbated by FCV dynamics.",high,worsening,Overall Implementation Progress (IP) Moderately Satisfactory Moderately Unsatisfactory,c6101545,P178891,Implementation Status and Results Report,2025-07-10T16:40:14.000Z
Fiduciary Risk Elevated in Fragile Context,"Fiduciary risk is rated 'High' and persistent, which in South Sudan's FCV context indicates challenges in financial management, procurement, and accountability for project funds in an environment of weak governance.",high,persistent,Fiduciary High High High,07cd079b,P178891,Implementation Status and Results Report,2025-07-10T16:40:14.000Z
Delayed Project Mobilization in Conflict-Affected Areas,"The project targets Juba and Yei areas, including refugee camps and host communities. The Owner's Engineer contract was only signed on December 17, 2024 (nearly 10 months after effectiveness), suggesting significant delays in mobilizing implementation in these sensitive FCV-affected locations.",high,worsening,"The Owner's Engineer contract was signed on December 17, 2024.",7c29ab93,P178891,Implementation Status and Results Report,2025-07-10T16:40:14.000Z
Volatile Security Situation Constraining Project Implementation,"Ongoing security volatility in target areas is directly impeding civil works implementation, causing delays and necessitating contingency planning for reallocation of investments to accessible areas.",high,persistent,"Poor road conditions and constrained access to subproject sites due to seasonal rains and flooding, as well as a volatile security situation in target areas present continued implementation challenges and risk further delays.",f2f17624,P177093,Implementation Status and Results Report,2025-07-10T10:15:15.000Z
Access Constraints in Conflict-Affected Areas Limiting Monitoring,"Delayed hiring of Third Party Monitoring Agent (TPMA) is compounded by difficulty accessing remote and conflict-affected areas for independent verification of project activities, undermining accountability and oversight.",high,persistent,"The TPMA has not been hired, making it challenging to independently verify project activities, especially in remote and conflict-affected areas.",260a4fef,P177093,Implementation Status and Results Report,2025-07-10T10:15:15.000Z
Refugee and Host Community Integration Tensions,"Project operates in refugee-hosting counties (Pariang and Maban) with significant refugee populations (182,000 targeted beneficiaries) and host communities (85,000 targeted), creating potential for resource competition and social tensions that could affect implementation and sustainability.",medium,unclear,PMU and IPs are compiling data to disaggregate the number of refugees who benefit from improved infrastructure due to the project in the two refugee-hosting counties (Pariang and Maban)... PMU and IPs are are compiling data to disaggregate the number of host community members that have access to improved infrastructure due to the project within the two refugee-hosting counties (Pariang and Maban).,a279f9ff,P177093,Implementation Status and Results Report,2025-07-10T10:15:15.000Z
Governance Fragility Affecting Institutional Strengthening Implementation,"Significant gaps remain in institutional strengthening at national, state, and county levels, with weak government oversight and leadership of core institutional capacity-building activities, limiting effectiveness of governance improvements.",high,persistent,"There remain gaps in institutional strengthening at the national, state and county level. This being a core mandate of the government, there is need for stronger oversight and leadership of institutional strengthening activities.",576d949a,P177093,Implementation Status and Results Report,2025-07-10T10:15:15.000Z
Access Constraints in Conflict-Affected Areas Delaying Emergency Response Activities,"Emergency Flood Response component activities in Warrap State are delayed due to access constraints, preventing completion of infrastructure prioritization and assessment work necessary for implementation.",medium,persistent,"In Warrap, the longlist has been completed in Gogrial West County while the one in Twic County is yet to be finalized (due to access constraints).",748d120c,P177093,Implementation Status and Results Report,2025-07-10T10:15:15.000Z
Staff Turnover and Loss of Trained Counterparts Undermining Reform Implementation,"Key technical staff who received capacity building on IFMIS implementation, treasury management, and internal audit have been reassigned to unrelated departments without official communication of replacements, disrupting continuity of PFM reform implementation.",high,worsening,"During the MTR, key counterparts for IFMIS Implementation, treasury management and internal audit who already received capacity building were reassigned to other non-related departments. The replacement of these counterparts has not been communicated officially.",ab0fb429,P176761,Aide Memoire,2025-07-03T16:40:03.000Z
Frequent Changes in Ministry Leadership Preventing Budget Preparation Compliance,"High turnover rate of Ministers of Finance is preventing timely decision-making and compliance with budget preparation timelines, directly impacting project PDO achievement on budget submission timeliness.",high,persistent,The high turnover rate of the Ministers of Finance has negatively impacted on the budget's calendar compliance.,338bba68,P176761,Aide Memoire,2025-07-03T16:40:03.000Z
Weak Government Capacity and Lack of Foundational Conditions for Reform Implementation,"Government agencies lack basic organizational and infrastructure conditions (offices, furniture, clear departmental functions, job descriptions) and have weak capacity to implement PFM reforms, compounded by recurrent changes of technical officials without required skills.",high,persistent,"Lack of minimum conditions for implementing reforms, and the government's low capacity to implement PFM reforms have generated significant delays for the implementation of the project. Some agencies lack the basic organizational and infrastructure conditions to start implementation of reforms, such as lack of offices, furniture. They also suffer from a lack of clear departmental functions, or job descriptions, among others, and it is necessary to start creating those basic conditions prior to the PFM reforms. This has also been compounded by the frequent changes in leadership and staff turnover. The government's capacity for implementing reforms is weak and negatively impacted by recurrent changes of technical officials without the required skills.",eb80f564,P176761,Aide Memoire,2025-07-03T16:40:03.000Z
