risk_title,risk_summary,severity,direction,evidence_quote,realized_risk_id,PROJ_ID_IB,doc_type,doc_date
Political and Governance Instability Affecting Project Implementation,"Political and governance risks remain at High level throughout project implementation, contributing to implementation challenges and early project closure. The project faced substantial delays linked to the fragile governance environment in Afghanistan.",high,persistent,Political and Governance High High High,83f47e0a,P161348,Implementation Status and Results Report,2021-05-10T00:00:00.000Z
Government Capacity Constraints and Competing Priorities,"The government's emergency response to COVID-19 forced cancellation of over 70% of project funds, indicating weak institutional capacity to manage multiple priorities and vulnerability to external shocks in a fragile state context.",high,worsening,Over 70 percent of the funds had to be cancelled in June 2020 to release the funds for the government's emergency response to COVID-19 pandemic which had substantially reduced the scope of the project.,b8ba06ce,P161348,Implementation Status and Results Report,2021-05-10T00:00:00.000Z
Institutional Capacity Deterioration for Implementation,"Institutional capacity for implementation and sustainability has worsened from Substantial at approval to High risk rating, reflecting challenges in maintaining project momentum in a fragile governance environment.",high,worsening,Institutional Capacity for Implementation and Sustainability Substantial High High,2a4204cc,P161348,Implementation Status and Results Report,2021-05-10T00:00:00.000Z
Macroeconomic Instability Affecting Project Viability,"Macroeconomic risks remain at High level throughout implementation, creating an unstable environment for banking sector reforms and state-owned bank modernization.",high,persistent,Macroeconomic High High High,1f30a34a,P161348,Implementation Status and Results Report,2021-05-10T00:00:00.000Z
Staffing Instability in State Banks Due to Security/Political Factors,"Senior management and board positions remain vacant or unstable, with documented cases of resignations and deaths (including COVID-related), indicating difficulty retaining qualified personnel in a fragile security environment.",medium,persistent,"during the FY 2020, two of the BoS positions in BMA became vacant due to one member died of COVID and the other resigned.",f0083437,P161348,Implementation Status and Results Report,2021-05-10T00:00:00.000Z
