risk_title,risk_summary,severity,direction,evidence_quote,realized_risk_id,PROJ_ID_IB,doc_type,doc_date
ARTF Cancellation Due to Extraordinary Political Situation,"The Afghanistan Reconstruction Trust Fund (ARTF) portion of the project grant was canceled, and IDA grant disbursements remain suspended due to the current extraordinary situation in Afghanistan, directly impacting project implementation capacity.",high,worsening,The Afghanistan Reconstruction Trust Fund (ARTF) portion of the grant for the project was canceled based on the consideration that the project cannot be effectively implemented under the current extraordinary situation in Afghanistan. Undisbursed IDA grant under this project will remain suspended until a decision is made by the World Bank.,45c989ca,P164443,Implementation Status and Results Report,2022-11-29T00:00:00.000Z
Political and Governance Risk Elevation,"Political and Governance risk rating has remained at High level from project approval through current reporting, indicating persistent governance fragility affecting project implementation.",high,persistent,"Risk Category: Political and Governance - Rating at Approval: High, Previous Rating: High, Current Rating: High",d91d58d4,P164443,Implementation Status and Results Report,2022-11-29T00:00:00.000Z
Macroeconomic Risk Escalation,"Macroeconomic risk has escalated from Substantial at approval to High in previous and current ratings, reflecting deteriorating economic conditions affecting project viability.",high,worsening,"Risk Category: Macroeconomic - Rating at Approval: Substantial, Previous Rating: High, Current Rating: High",84061a39,P164443,Implementation Status and Results Report,2022-11-29T00:00:00.000Z
Sector Strategies and Policies Risk Elevation,"Sector Strategies and Policies risk has escalated from Substantial at approval to High in previous and current ratings, indicating instability in the policy environment.",high,worsening,"Risk Category: Sector Strategies and Policies - Rating at Approval: Substantial, Previous Rating: High, Current Rating: High",65ae0f4b,P164443,Implementation Status and Results Report,2022-11-29T00:00:00.000Z
Institutional Capacity Deterioration,"Institutional Capacity for Implementation and Sustainability risk has escalated from Moderate at approval to High in previous and current ratings, indicating weakening government capacity to implement the project.",high,worsening,"Risk Category: Institutional Capacity for Implementation and Sustainability - Rating at Approval: Moderate, Previous Rating: High, Current Rating: High",1912c10a,P164443,Implementation Status and Results Report,2022-11-29T00:00:00.000Z
Fiduciary Risk Escalation,"Fiduciary risk has escalated from Substantial at approval to High in previous and current ratings, reflecting governance and control concerns in the extraordinary situation.",high,worsening,"Risk Category: Fiduciary - Rating at Approval: Substantial, Previous Rating: High, Current Rating: High",369e7e04,P164443,Implementation Status and Results Report,2022-11-29T00:00:00.000Z
Stakeholder Risk Elevation,"Stakeholder risk has escalated from Substantial at approval to High in previous and current ratings, indicating tensions or challenges with development actors and beneficiary engagement.",high,worsening,"Risk Category: Stakeholders - Rating at Approval: Substantial, Previous Rating: High, Current Rating: High",5790d385,P164443,Implementation Status and Results Report,2022-11-29T00:00:00.000Z
