risk_title,risk_summary,severity,direction,evidence_quote,realized_risk_id,PROJ_ID_IB,doc_type,doc_date
Political and Governance Instability Affecting Implementation Coordination,"The project faces persistent substantial political and governance risks that constrain inter-departmental coordination required for implementation. Multiple critical activities require coordination between Finance Departments and Health Departments across provinces, with delays attributed to governance fragility.",high,persistent,Implementation is pending and it requires coordination with Finance Department and Controller General Accounts.,7eb3bfe6,P172615,Implementation Status and Results Report,2025-05-28T17:50:07.000Z
Provincial Governance Fragmentation Impeding Referral System Implementation,"Referral system implementation is stalled in KP and Sindh provinces due to governance challenges, with only Punjab having finalized guidelines. This reflects broader provincial governance fragility affecting health service coordination.",high,persistent,Referral guidelines finalized in Punjab but are being drafted in KP and Sindh provinces.,2fe1a90b,P172615,Implementation Status and Results Report,2025-05-28T17:50:07.000Z
Governance Capacity Constraints in Health Information System Integration,"Health information system integration is progressing unevenly across provinces, with KP and Sindh facing governance and institutional capacity challenges in implementing DHIS2. This reflects fragile institutional capacity for coordinated implementation.",medium,persistent,"Punjab has integrated its information system in EMR, while Sindh and KP are designing DHIS2 for integration. KP and Sindh are expected to have DHIS2 dashboard ready by December 2024.",eb63a9f8,P172615,Implementation Status and Results Report,2025-05-28T17:50:07.000Z
Governance Barriers to Performance Management System Implementation,"Performance management system implementation in Punjab is stalled at draft stage awaiting departmental endorsement, indicating governance-level institutional constraints affecting accountability mechanisms.",medium,persistent,Document finalized by the health department but endorsement pending,580707b6,P172615,Implementation Status and Results Report,2025-05-28T17:50:07.000Z
Provincial Governance Fragmentation in Public Financial Management,"Public Financial Management policy implementation remains incomplete across provinces, with KP and Sindh having finalized policies but facing implementation delays due to coordination challenges between Finance and Health Departments.",medium,persistent,This activity was to be implemented by Sindh. It is part of the PFM policy note of Sindh which is approved now. This activity will be implemented in consultation with the Finance Department.,2ced4cbd,P172615,Implementation Status and Results Report,2025-05-28T17:50:07.000Z
