risk_title,risk_summary,severity,direction,evidence_quote,realized_risk_id,PROJ_ID_IB,doc_type,doc_date
Project Implementation Halted Due to Extraordinary Political Situation,"The project cannot be effectively implemented under the current extraordinary situation in Afghanistan, leading to cancellation of ARTF funds and suspension of implementation activities.",high,new,This ISR documents the decision to cancel ARTF funds in the project is based on the consideration that the project cannot be effectively implemented under the current extraordinary situation in Afghanistan.,f891da8a,P174348,Implementation Status and Results Report,2022-04-10T00:00:00.000Z
Political and Governance Instability Escalation,"Political and Governance risk rating has remained consistently high throughout project implementation, indicating persistent governance fragility affecting project execution.",high,persistent,"Political and Governance [Risk Category Rating at Approval: High, Previous Rating: High, Current Rating: High]",08529658,P174348,Implementation Status and Results Report,2022-04-10T00:00:00.000Z
Macroeconomic Crisis Impacting Implementation,"Macroeconomic risk has escalated from Substantial to High, reflecting deteriorating economic conditions that threaten project viability and implementation capacity.",high,worsening,"Macroeconomic [Risk Category Rating at Approval: Substantial, Previous Rating: Substantial, Current Rating: High]",9f44f566,P174348,Implementation Status and Results Report,2022-04-10T00:00:00.000Z
Institutional Capacity Collapse for Implementation,"Institutional capacity for implementation and sustainability risk has escalated to High, indicating the implementing agencies (Ministry of Agriculture, Irrigation and Livestock, Ministry of Finance) lack capacity to execute project activities under current conditions.",high,worsening,"Institutional Capacity for Implementation and Sustainability [Risk Category Rating at Approval: Substantial, Previous Rating: Substantial, Current Rating: High]",53f392d6,P174348,Implementation Status and Results Report,2022-04-10T00:00:00.000Z
Fiduciary Risk Escalation,"Fiduciary risk has escalated from Substantial to High, indicating compromised ability to manage funds and ensure accountability in the extraordinary situation.",high,worsening,"Fiduciary [Risk Category Rating at Approval: Substantial, Previous Rating: Substantial, Current Rating: High]",f8a5a658,P174348,Implementation Status and Results Report,2022-04-10T00:00:00.000Z
Sector Strategies and Policies Destabilization,"Sector strategies and policies risk has escalated to High, suggesting the policy environment for agriculture and food supply is no longer conducive to project implementation.",high,worsening,"Sector Strategies and Policies [Risk Category Rating at Approval: Moderate, Previous Rating: Moderate, Current Rating: High]",471332df,P174348,Implementation Status and Results Report,2022-04-10T00:00:00.000Z
Technical Design Viability Compromised,"Technical design risk has escalated to High, indicating the project's technical approach is no longer feasible under current extraordinary circumstances.",high,worsening,"Technical Design of Project or Program [Risk Category Rating at Approval: Moderate, Previous Rating: Moderate, Current Rating: High]",7ad56f1a,P174348,Implementation Status and Results Report,2022-04-10T00:00:00.000Z
Stakeholder Engagement Deterioration,"Stakeholder risk has escalated to High, suggesting tensions or inability to engage with government and development actors in the current political environment.",high,worsening,"Stakeholders [Risk Category Rating at Approval: Moderate, Previous Rating: Moderate, Current Rating: High]",2bfabb53,P174348,Implementation Status and Results Report,2022-04-10T00:00:00.000Z
