risk_title,risk_summary,severity,direction,evidence_quote,realized_risk_id,PROJ_ID_IB,doc_type,doc_date
Delayed SRGBV Training Implementation Affecting Violence Prevention,"Sexual and reproductive gender-based violence (SRGBV) training for 2,000 school management committees and boards of governors was scheduled for January-February 2025 but has been rescheduled to April 2025, delaying critical violence prevention capacity building in schools.",medium,worsening,"SRGBV Training for 2000 (SMCs, BOGs) Jan-Feb 2025... Planning will start in January to commence in April",561a01e9,P167897,Aide Memoire,2025-04-15T17:30:03.000Z
Incomplete GBV Response and Safeguarding Framework,"Multiple critical safeguarding activities remain not started, including GBV/SEA/SH refresher training, social audits, and accountability frameworks for GBV response, creating gaps in institutional capacity to address violence in schools.",high,persistent,Conduct GBV/SEA/SH refresher training 31-Mar-25... not started; Mid-term review of social audit findings 28-Feb-25... not started; outline a clear accountability framework for those working in GBV response/mitigation... 28-Feb-25... not started,9fa3875c,P167897,Aide Memoire,2025-04-15T17:30:03.000Z
Delayed School Safety Standards Development,"Development of school safety standards, critical for protecting students from violence and conflict-related threats, remains incomplete despite a February 2025 deadline.",medium,persistent,Develop school safety standards 28-Feb-25... Draft completed,1ed9fcab,P167897,Aide Memoire,2025-04-15T17:30:03.000Z
Stalled Social Audit Implementation for Accountability,"Social audits to assess institutional accountability and safeguarding mechanisms have not been initiated, delaying evidence-based identification of governance and violence-related vulnerabilities.",medium,persistent,Supervise consultants conducting social audits 31-Jan-25... not started,99fe705f,P167897,Aide Memoire,2025-04-15T17:30:03.000Z
Delayed Grievance Redress Mechanism Follow-up,"Follow-up visits to Grievance Redress Mechanisms (GRMs) and Grievance Redress Committees (GRCs) post-protocol rollout are contingent on completion of training, creating delays in monitoring institutional responsiveness to conflict and violence complaints.",medium,persistent,Follow-up visits to GRMs/GRCs post-protocol roll-out 31-Mar-25... contingent upon completion of training,c478197f,P167897,Aide Memoire,2025-04-15T17:30:03.000Z
Incomplete Male Engagement Strategy for GBV Prevention,"Identification of male gender equality champions and development of a male engagement approach for GBV prevention and response remains incomplete, limiting comprehensive violence prevention efforts.",low,persistent,Identify male gender equality champions from MBSSE and develop an action plan to pilot male engagement approach towards GBV prevention and response 28-Feb-25... to be during the training,41b4762d,P167897,Aide Memoire,2025-04-15T17:30:03.000Z
