risk_title,risk_summary,severity,direction,evidence_quote,realized_risk_id,PROJ_ID_IB,doc_type,doc_date
Governance and Institutional Coordination Gaps Affecting Project Safety Implementation,"Weak coordination between project implementing agencies (ADR, contractor, MSV) and external service providers (ONEAD utility company) is causing delays in critical safety measures and creating hazardous conditions on construction sites. Delays in utility adjustments are leaving trenches open, creating safety risks.",high,persistent,L'entrepreneur a exprimé ses préoccupations concernant le manque de coopération de l'ONEAD et a demandé le soutien de l'ADR pour accélérer le processus. Ces tranchées ouvertes représentent un risque pour la sécurité.,4ea865d7,P174300,Aide Memoire,2025-07-16T05:25:05.000Z
Inadequate Government Oversight and Enforcement of Safety Standards,"Government quarterly reports lack detail on non-conformities observed in the field, indicating weak monitoring and enforcement capacity. Critical safety violations documented during field visits were not reported in official government submissions, suggesting governance gaps in accountability.",high,persistent,"Le gouvernement a partagé avec la mission le rapport trimestriel dans les délais, cependant celui-ci manquait de détails concernant les non-conformités observées sur le terrain, lesquelles n'ont pas été signalées dans le document.",73ef1696,P174300,Aide Memoire,2025-07-16T05:25:05.000Z
Systemic Non-Compliance with Labor and Social Protection Standards,"Widespread violations of labor regulations affecting 150 daily workers, including non-compliant contracts lacking official stamps, workers not registered with national social security, and inaccurate accident records. These governance and compliance failures expose vulnerable workers to exploitation and safety risks.",high,persistent,"les contrats des 150 journaliers ne sont pas conformes (absence de cachets officiels, copies non remises aux employés), plusieurs travailleurs ne possèdent pas de carte de la Caisse Nationale de Sécurité Sociale (CNSS), et des incohérences significatives apparaissent dans les registres d'accidents.",7d2839a2,P174300,Aide Memoire,2025-07-16T05:25:05.000Z
Critical Safety and Health Violations Creating Acute Risk to Workers and Communities,"Multiple critical safety failures documented on construction sites including absence of dedicated HSE agents, unsecured trenches, inadequate separation between machinery and vulnerable road users, poor nighttime signaling, and workers exposed to extreme heat without adequate shelter. These conditions create grave accident risks.",high,persistent,"l'absence d'agents Hygiène Sécurité Environnement (HSE) dédiés, de nombreuses tranchées non sécurisées, une séparation insuffisante entre les engins et personnes vulnérables utilisant la route dont les piétons, et une signalisation nocturne inadéquate dans les zones de rétrécissement. Ces manquements exposent les travailleurs, les usagers et les communautés riveraines à des risques graves d'accidents.",b3d106d2,P174300,Aide Memoire,2025-07-16T05:25:05.000Z
High Road Safety Risk on Project Corridor with Inadequate Mitigation,"The project corridor experiences a high number of road accidents. While 13 traffic incidents unrelated to work zones have been reported, the underlying road safety conditions remain problematic, requiring strengthened signaling and safety measures across the corridor.",high,persistent,"Prenant en compte le nombre élevé d'accidents de routes sur le corridor, ainsi que les recommandations suite à la visite de terrain, la mission a souligné l'importance du respect des normes de sécurité routière sur les tronçons inclus dans le cadre du projet.",b71f16e3,P174300,Aide Memoire,2025-07-16T05:25:05.000Z
Weak Environmental and Social Compliance Reporting by Government,Government environmental and social reports lack detail on documented non-conformities and fail to reflect critical field conditions. This indicates weak institutional capacity for monitoring and reporting on project compliance with World Bank standards.,medium,persistent,"Le gouvernement a partagé avec la mission le rapport trimestriel dans les délais, cependant celui-ci manquait de détails concernant les non-conformités observées sur le terrain, lesquelles n'ont pas été signalées dans le document.",8412ff82,P174300,Aide Memoire,2025-07-16T05:25:05.000Z
Unresolved Resettlement and Land Use Conflicts at Arta Site,"Proposed road widening at Arta would cause significant resettlement impacts. Five informal commercial structures were installed after census cutoff date. Government is considering relocating these businesses, but alternative solutions (avoiding widening, creating rest zone) remain under examination, creating uncertainty for affected communities.",medium,persistent,"La mission a été informée de l'installation de cinq commerces (cabanons) le long du tracé du contrat en cours du projet parent. Ces commerces ont été installés après la date de fin du recensement. En concertation avec les propriétaires, le Gouvernement envisage de déplacer les commerces de quelques mètres.",8d700c14,P174300,Aide Memoire,2025-07-16T05:25:05.000Z
