risk_title,risk_summary,severity,direction,evidence_quote,realized_risk_id,PROJ_ID_IB,doc_type,doc_date
Inactive Project Steering Committee Delaying Governance,"The project steering committee for SKILLS has not yet become operational, creating a governance gap that may impede coordination and decision-making on project implementation.",medium,persistent,"Le comité de pilotage du projet Skills n'est pas encore actif, la mission est en discussion avec les institutions concernées sur une alternative définitive pour la mise en place d'un comité de pilotage du projet.",864d5ec1,P175483,Aide Memoire,2025-02-14T11:25:05.000Z
Refugee Profiling and Skills Development Implementation Delays,"While refugee profiling assessments have been conducted in camps (Ali Addeh, Holhol, Markasi), the implementation of adapted training plans for refugee youth remains incomplete and dependent on coordination between multiple ministries, creating execution risks.",medium,worsening,"Un consultant a démarré une mission sur le terrain dans les camps d'Ali Addeh, Holhol et Markasi pour réaliser un rapport sur le profilage des réfugiés... le MENFOP prévoit de finaliser un plan de formation dédié aux réfugiés en décembre 2024. Cette action sera pilotée entre le ministère de l'éducation, le ministère de travail et le projet zéro bidonville.",c5ee02de,P175483,Aide Memoire,2025-02-14T11:25:05.000Z
Governance Implementation Gaps in EFTP Institutional Reform,"Although regulatory texts for EFTP governance modernization have been drafted and signed (including establishment of sectoral working groups and institutional governance councils), their application remains incomplete and not fully effective, undermining institutional capacity.",medium,persistent,"Bien que ses actions sont constitué et signé, l'application n'est pas encore pleinement effective. En ce qui concerne le conseil de gouvernance, sa mise en place est en cours.",8d695545,P175483,Aide Memoire,2025-02-14T11:25:05.000Z
Delayed Environmental and Social Safeguards Reporting and Implementation,"Environmental and Social (E&S) safeguards management is only moderately satisfactory due to delayed reporting, unimplemented stakeholder mobilization plans, missing GBV action plans, and non-implementation of prepared Environmental and Social Management Plans (PGES) for rehabilitation works.",medium,persistent,"Le rapport attendu en juillet 2024 a été transmis avec trois mois de retard... Le planning partagé lors de la précédente mission n'a pas été mis en œuvre... Malgré la formation ESAHS en juin 2024, le plan d'action VBG convenu n'a pas été transmis... Les PGES pour la réhabilitation des lycées techniques sont prêts mais non mis en œuvre.",bcdff420,P175483,Aide Memoire,2025-02-14T11:25:05.000Z
Internal Audit Function Independence Compromised,"The internal audit function lacks organizational and functional independence from project coordination, creating conflicts of interest and compromising audit objectivity in evaluating project management performance.",high,persistent,La fonction d'audit interne existe mais pour le moment est assurée par un consultant individuel qui est sous l'autorité hiérarchique de la même coordination dont il a l'obligation de revoir les processus internes – ce qui pose un problème manifeste d'indépendance et objectivité de la fonction... Ceci crée une compromission (quoique involontaire) de l'indépendance et/ou l'objectivité de la fonction d'Audit Interne.,6336f09d,P175483,Aide Memoire,2025-02-14T11:25:05.000Z
