risk_title,risk_summary,severity,direction,evidence_quote,realized_risk_id,PROJ_ID_IB,doc_type,doc_date
Sustainability challenges for community infrastructure maintenance,"Community-managed water and hydraulic infrastructure requires ongoing maintenance funding and management capacity, with communities facing challenges in securing resources for long-term upkeep.",medium,persistent,"quelques défis subsistent, notamment la gestion des fonds nécessaires pour l'entretien et la maintenance de ces ouvrages",5ff197c1,P508560,Aide Memoire,2025-07-11T06:35:05.000Z
Capacity constraints in financial management and governance of rural savings groups,"Rural savings and credit groups (CREC) face challenges in governance, regular savings mobilization, and financial management capacity, requiring sustained support adapted to local realities.",medium,persistent,des capacités limitées en gestion financière et en suivi,fc1ba074,P508560,Aide Memoire,2025-07-11T06:35:05.000Z
Difficult road accessibility in rural regions impacting project implementation,"Poor road infrastructure and seasonal conditions in remote rural areas are causing logistical delays in the distribution of in-kind transfers and limiting access for implementation teams, particularly during rainy seasons.",medium,persistent,"les conditions routières difficiles, particulièrement pendant la saison des pluies, rend certaines localités difficiles d'accès pour les équipes de distribution et les transporteurs, ce qui a occasionné des retards logistiques dans la livraison des vivres",7738ea87,P180999,Aide Memoire,2025-07-11T06:35:05.000Z
Limited economic viability and market access in remote localities,"Remote rural areas face constraints in identifying viable income-generating activities due to weak market access and lack of economic diversification, limiting the effectiveness of livelihood support activities (AGR and CREC).",medium,persistent,"Dans certaines localités reculées, il est également difficile d'identifier des activités génératrices de revenus viables, en raison du faible accès aux marchés et du manque de diversification économique",859cc703,P180999,Aide Memoire,2025-07-11T06:35:05.000Z
Weak community grievance mechanism affecting beneficiary concerns,"The current complaint management mechanism has structural weaknesses that limit effective and timely response to beneficiary concerns, potentially affecting project credibility and community trust.",medium,persistent,La mission estime que le fonctionnement du mécanisme de gestion des plaintes actuel présente des faiblesses et recommande de l'améliorer pour garantir une réponse efficace et rapide aux préoccupations des bénéficiaires,da866d49,P180999,Aide Memoire,2025-07-11T06:35:05.000Z
Inadequate stakeholder mobilization and beneficiary participation,Weak documentation of stakeholder mobilization and limited beneficiary participation in project activities may undermine community ownership and project sustainability.,medium,persistent,La mission recommande de renforcer la mobilisation des parties prenantes pour assurer une meilleure participation des bénéficiaires et soutien au projet,f4356e23,P180999,Aide Memoire,2025-07-11T06:35:05.000Z
Risks associated with youth training program implementation,"Youth training activities targeting 400 beneficiaries in interior regions require proactive risk management to ensure equal opportunity and fair treatment, particularly for vulnerable populations, with concerns about eligibility criteria transparency and information accessibility.",medium,new,"La mission recommande vivement que les risques associés à ces formations soient traités de manière proactive pour garantir l'égalité de chances et le traitement équitable, tout en tenant compte du public vulnérable. A cet effet, il est important de définir préalablement les critères d'éligibilités, accessibilité de l'information et la mise en place d'une procédure de sélection transparente et juste",477992e7,P180999,Aide Memoire,2025-07-11T06:35:05.000Z
Sustainability challenges for community infrastructure maintenance,"Community-managed infrastructure (water systems, boreholes) faces sustainability risks due to limited community capacity and insufficient funding mechanisms for long-term maintenance and operations.",medium,persistent,"Cependant, quelques défis subsistent, notamment la gestion des fonds nécessaires pour l'entretien et la maintenance de ces ouvrages",b7d9d0f8,P180999,Aide Memoire,2025-07-11T06:35:05.000Z
Governance and financial management capacity constraints in rural savings groups,"Rural savings and credit groups (CREC) face challenges in governance, regular savings mobilization, and financial management capacity, requiring sustained support adapted to local realities.",medium,persistent,"Cependant, des défis subsistent, ce qui nécessite un accompagnement constant pour assurer une gestion optimale. En effet, parmi les défis figurent la pérennisation des structures, la mobilisation régulière de l'épargne, la sensibilisation à la bonne gouvernance, ainsi que des capacités limitées en gestion financière et en suivi",2a97c934,P180999,Aide Memoire,2025-07-11T06:35:05.000Z
Political and Governance Risk - Substantial Rating Maintained,"Political and governance risks remain at Substantial level, indicating fragility in the operating environment that could affect project implementation in Djibouti.",high,persistent,Political and Governance Substantial Substantial,1deba1dd,P506969,Implementation Status and Results Report,2025-06-30T18:15:18.000Z
Refugee and Host Community Integration Challenges,"Project targets both refugee and host community populations (12,860 refugees and 15,900 host community residents as direct beneficiaries), creating potential for tensions between groups that could affect implementation.",medium,unclear,"Of which refugees (Number) 0 Mar/2025 12,860 Jun/2029 Of which host community residents (Number) 0 Mar/2025 0 27-Jun-2025 15,900 Jun/2029",e3db9905,P506969,Implementation Status and Results Report,2025-06-30T18:15:18.000Z
Institutional Capacity Constraints in Fragile Context,"Institutional Capacity for Implementation and Sustainability rated as Substantial risk, suggesting implementing agencies (MASS and ADDS) may face challenges executing project activities in a fragile governance environment.",high,persistent,Institutional Capacity for Implementation and Sustainability Substantial Substantial,2c161b17,P506969,Implementation Status and Results Report,2025-06-30T18:15:18.000Z
Project Effectiveness Delays Affecting Implementation Timeline,"Project has not yet achieved legal effectiveness as of June 30, 2025, with deadline extension requested to August 2025, potentially delaying implementation in a context where political stability cannot be assured.",medium,worsening,"Project implementation is currently pending the fulfillment of legal effectiveness requirements, for which an extension of the deadline has been requested until August 2025.",145475bd,P506969,Implementation Status and Results Report,2025-06-30T18:15:18.000Z
Delayed adoption of Digital Code hampering project implementation,"The non-adoption of the Digital Code (Code du Numérique), particularly Book Two covering telecommunications regulation, is causing delays in multiple project activities across both DFN and EARDIP. This legislative gap is blocking the operationalization of regulatory frameworks needed for project implementation.",high,persistent,"Le Code du Numérique n'est toujours pas adopté. Cette situation entraîne le retard de plusieurs activités qui en dépendent... La mission réitère sa recommandation au Gouvernement de prendre les mesures nécessaires afin d'adopter rapidement le Code du Numérique ou le cas échéant, son livre deuxième portant le cadre légal et règlementaire du secteur des télécommunications",04fc68bf,P174461,Aide Memoire,2025-06-26T17:30:03.000Z
Governance fragility affecting regulatory capacity,The ARMD (regulatory authority) lacks its primary operational tool—the Digital Code Book Two—which is essential for regulating the telecommunications sector. This governance gap undermines the authority's ability to function effectively and implement project activities.,high,persistent,"le livre deuxième du code du numérique portant le secteur des télécommunications, qui constitue son principal outil de travail pour réguler le secteur, n'a pas encore été adopté",e53beecc,P174461,Aide Memoire,2025-06-26T17:30:03.000Z
Institutional coordination delays affecting project execution,"Delays in identifying beneficiary sites for the operational phase of internet capacity pre-purchase and slow progress in inter-agency coordination (ANSIE, MCPT, Technical Committee) are impacting project implementation timelines and connectivity rollout.",medium,persistent,Le Comité Technique (CT) poursuit ses travaux pour identifier les structures qui bénéficieront de la phase opérationnelle du préachat de capacité. Cependant la mission a noté que ce processus a accusé du retard.,05b8a360,P174461,Aide Memoire,2025-06-26T17:30:03.000Z
Government Administrative Delays Affecting Project Effectiveness,"The project cannot become effective because the Government has not signed and published required governance decrees and orders in the Official Gazette, despite Council of Ministers confirmation on February 25, 2025. This administrative delay is blocking project start and affecting coordination across all donor-funded PFM projects in Djibouti.",high,persistent,"The Council of Ministers confirmed the adoption of the decree and order on February 25, 2025. However, the decree and order have not been signed and published in the Official Gazette 'Journal Officiel', delaying the project's start.",2f90e270,P180696,Implementation Status and Results Report,2025-06-25T17:25:15.000Z
Weak Government Institutional Capacity for Project Governance Implementation,"Delays in operationalizing the PFM Reform Strategy governance structures are systemic across the sector, affecting all related donor projects. This indicates broader governance fragility and institutional capacity constraints within government structures responsible for coordinating economic and financial governance reforms.",high,persistent,delays in operationalizing the PFM Reform Strategy governance structures are affecting all related projects funded by donors in Djibouti.,3edd0152,P180696,Implementation Status and Results Report,2025-06-25T17:25:15.000Z
Political and Governance Risk Elevation,"The SORT tool maintains a 'High' rating for Political and Governance risk category across all assessment periods (Approval, April 2025, and current), indicating persistent and significant governance fragility that could undermine project implementation.",high,persistent,"Risk Category: Political and Governance - Rating at Approval: High, Last Approved Rating ISR Seq. 01: High, Proposed Rating: High",fe79651f,P180696,Implementation Status and Results Report,2025-06-25T17:25:15.000Z
Political and Governance Risk - Substantial Rating Maintained,"Political and governance risks remain rated as 'Substantial' across all project phases (approval, last approved rating, and proposed rating), indicating persistent governance fragility or political instability affecting project implementation in Djibouti.",high,persistent,"Risk Category: Political and Governance - Rating at Approval: Substantial, Last Approved Rating AF Seq. 01 Approval: Substantial, Proposed Rating: Substantial",aad4d559,P174300,Implementation Status and Results Report,2025-06-24T09:29:40.000Z
Macroeconomic Risk - Elevated to Substantial,"Macroeconomic risk has been elevated from 'Moderate' at project approval to 'Substantial' in the most recent rating, suggesting worsening economic conditions or fiscal pressures that may affect project implementation capacity and sustainability in Djibouti.",high,worsening,"Risk Category: Macroeconomic - Rating at Approval: Moderate, Last Approved Rating AF Seq. 01 Approval: Substantial, Proposed Rating: Substantial",b6adba28,P174300,Implementation Status and Results Report,2025-06-24T09:29:40.000Z
Refugee Student Integration Challenges,"Project implementation faces ongoing challenges integrating refugee students into the education system, with refugees identified as a priority vulnerable population requiring continued enrollment efforts but facing implementation barriers.",medium,persistent,"continuing the push to enroll more students, especially girls, refugees and children with special needs in school",7dffb336,P166059,Implementation Status and Results Report,2025-06-24T09:22:07.000Z
Refugee and Private School Data System Integration Gaps,"The Education Management Information System (EMIS) lacks integration of refugee schools and students in irregular situations, creating data gaps that may hinder targeted support and monitoring of vulnerable populations.",medium,persistent,"MENFOP is currently considering how to integrate students from the Accelerated Learning Program (ALP/PEA) who are in an irregular situation, and schools with no internet connection",c36bbdf6,P166059,Implementation Status and Results Report,2025-06-24T09:22:07.000Z
Refugee School Coverage in EMIS Expansion,"Project priorities explicitly identify adding refugee schools to the EMIS as a remaining task, indicating current gaps in monitoring and data collection for refugee education provision.",medium,persistent,adding refugee and private schools to the EMIS,9762b6fe,P166059,Implementation Status and Results Report,2025-06-24T09:22:07.000Z
Refugee Integration and Social Cohesion Assessment Delays,"Assessment of socio-economic inclusion and social cohesion of refugees in target areas (slum areas and refugee villages) has not been completed as of May 2025, despite being a key indicator for measuring refugee integration outcomes. This delays understanding of potential tensions or integration challenges.",medium,persistent,Assessment of socio-economic inclusion and social cohesion of refugees settled in all target areas (slum areas and refugee villages) done (Yes/No)... No 30-May-2025,b3f936cc,P162901,Implementation Status and Results Report,2025-06-23T13:41:13.000Z
Refugee Property Rights Documentation Stalled,"Property access certificates for refugees remain at zero as of May 2025, pending approval of village restructuring plans for Ali Addeh and Holl Holl refugee villages. This creates tenure insecurity and potential grievances among refugee populations.",medium,persistent,"Property access certificates delivered to refugees (Number)... 0.00 30-May-2025... This is related to the village restructuring plans, which are pending approval.",58399691,P162901,Implementation Status and Results Report,2025-06-23T13:41:13.000Z
Refugee-Led CSO Participation Stalled,"No refugee-led CSO sub-projects have been implemented as of May 2025, despite a target of 60 by December 2026. This indicates limited refugee community agency and participation in project activities.",medium,persistent,SEDF-funded sub-projects implemented by refugee-led CSO (Number)... 0.00 31-Oct-2023... 0.00 31-Oct-2023,b610d8df,P162901,Implementation Status and Results Report,2025-06-23T13:41:13.000Z
Refugee Law Implementation Recommendations Not Executed,"Zero recommendations from sectoral action plans for operationalizing the 2017 National Refugee Law have been implemented as of May 2025, despite five action plans being prepared. This indicates governance gaps in refugee policy implementation.",medium,persistent,Recommendations resulting from the sectoral action plans that have been implemented (Number)... 0.00 15-May-2024... 0.00 30-May-2025,c601463c,P162901,Implementation Status and Results Report,2025-06-23T13:41:13.000Z
Host-Refugee Social Cohesion Perception Data Missing,Beneficiary perception surveys on whether project investments reflected refugee and host community needs have not been conducted as of May 2025. This creates a gap in understanding potential social tensions or grievances.,low,persistent,Beneficiaries that feel project investments reflected their needs (Percentage)... 0.00 31-Oct-2022... Not yet conducted,11c6ac8c,P162901,Implementation Status and Results Report,2025-06-23T13:41:13.000Z
Refugee Enrollment and Completion Gaps,"The project targets refugee beneficiaries but is experiencing zero actual enrollment and completion among refugees across multiple indicators, despite baseline targets. This suggests barriers to refugee access or participation in TVET programs that may be FCV-related (displacement, documentation, security concerns, or integration tensions).",high,persistent,"Increased enrollment in selected TVET areas - Refugees (Number): Baseline 220.00, Actual (Current) 0, Closing Period 800.00",b86fca63,P175483,Implementation Status and Results Report,2025-05-29T11:36:29.000Z
Refugee Training Completion Failure,Zero refugees have completed TVET programs to date despite project targets of 40% completion rate for refugees. This indicates systematic barriers preventing refugee participation in or completion of training activities.,high,persistent,"Share of trainees completing TVET programs increased - Refugees (Percentage): Baseline 0.00, Actual (Current) 0, Closing Period 40.00",a44a7c9a,P175483,Implementation Status and Results Report,2025-05-29T11:36:29.000Z
Refugee Employment Outcomes Stalled,"No refugees have achieved employment 6 or 9 months after program completion, with actual results at 5% (baseline) remaining unchanged. This suggests either zero program completions among refugees or employment barriers specific to refugee populations.",high,persistent,"Share of trainees employed 6 months after completion of their programs in similar sectors - Refugees (Percentage): Baseline 5.00, Actual (Current) 5, Closing Period 50.00",957d80cc,P175483,Implementation Status and Results Report,2025-05-29T11:36:29.000Z
Refugee Participation in Short-term Training Minimal,"Only 195 refugees have completed short-term training programs against a target of 1,040 by project closing. This indicates significant underperformance in reaching refugee beneficiaries in training activities.",medium,worsening,"Number of short-term training programs completed - Refugees (Number): Baseline 0.00, Actual (Current) 195, Closing Period 1,040.00",72626aa2,P175483,Implementation Status and Results Report,2025-05-29T11:36:29.000Z
Resettlement delays affecting project implementation in slum areas,"Project investments in four slums are pending due to remaining resettlements that have not been completed, causing delays in construction and upgrading activities.",medium,persistent,"Two other investments (CDC and sports field) have started, while others are pending due to a few remaining resettlements.",703474ae,P162901,Implementation Status and Results Report,2025-05-25T20:51:42.000Z
Institutional capacity constraints at Land Directorate blocking land regularization,"Land regularization files have been blocked since October 2023 due to the Land Directorate's prioritization of data migration, directly impacting the project's land certificate delivery targets and affecting host communities and refugees seeking property access.",medium,persistent,"Progress has been slow and the files have been blocked by the Land Directorat since October, 2023 due to the priority it has given to the migration of INFOCAD data to the ArcGIS software.",45e2d0fe,P162901,Implementation Status and Results Report,2025-05-25T20:51:42.000Z
"Refugee village restructuring plans pending approval, delaying refugee-focused investments","Construction in refugee villages (Ali Addeh and Holl Holl) is delayed as restructuring plans are under validation and awaiting approval, affecting property access certificates and socioeconomic integration activities for refugees.",medium,persistent,"Meanwhile, the program for investments in refugee villages is under validation, with construction expected to start in the spring.",ad3a752a,P162901,Implementation Status and Results Report,2025-05-25T20:51:42.000Z
Zero implementation of refugee-led CSO sub-projects despite targets,"No refugee-led CSO sub-projects have been implemented (0 out of 60 target), indicating potential governance or institutional barriers to refugee economic integration and participation in project activities.",medium,persistent,SEDF-funded sub-projects implemented by refugee-led CSO (Number) 0.00 Oct/2019 0.00 31-Oct-2023 0.00 31-Oct-2023 60.00 Dec/2026,22da437e,P162901,Implementation Status and Results Report,2025-05-25T20:51:42.000Z
No progress on training civil servants to implement National Refugee Law,"Zero civil servants and civil society members have been trained on the 2017 National Refugee Law implementation despite a target of 100, indicating governance capacity gaps in refugee policy operationalization.",medium,persistent,"National and local civil servants, and civil society members that were trained to foster the implementation of the 2017 Refugee Law (Number) 0.00 Sep/2020 0.00 15-May-2024 0.00 15-May-2024 100.00 Dec/2025",6bf4237b,P162901,Implementation Status and Results Report,2025-05-25T20:51:42.000Z
No implementation of sectoral action plan recommendations for refugee law operationalization,"Despite five sectoral action plans being prepared for the National Refugee Law, zero recommendations have been implemented as of May 2024, indicating governance and institutional implementation gaps.",medium,persistent,Recommendations resulting from the sectoral action plans that have been implemented (Number) 0.00 Sep/2020 0.00 15-May-2024 0.00 15-May-2024 6.00 Dec/2025,0589f50b,P162901,Implementation Status and Results Report,2025-05-25T20:51:42.000Z
Coordination and Planning Difficulties Affecting Immunization Service Delivery,"Continued difficulties with coordination and planning are impacting immunization service delivery quality and outreach, affecting the project's ability to achieve immunization targets across the population, including refugees and host communities.",medium,persistent,"Poor quality of immunization registered filling. Continued difficulties with coordination, planning and outreach.",c33165e7,P178033,Implementation Status and Results Report,2025-04-19T14:55:06.000Z
Low Functional Community Health Worker Implementation in Refugee and Host Community Areas,"Communities with functioning community health workers per national norms remain at 0% achievement, with only a proposal to hire 500 community health workers pending ministerial consideration. This affects service delivery in underserved areas including refugee populations.",medium,persistent,Communities with functioning community health workers per the norms set by the National Community Health Strategy (Percentage)... 0.00 31-Dec-2024... The National Community Health Strategy is formulated and a proposal to hire 500 community health workers is made to the Minister of Health for consideration.,a7226351,P178033,Implementation Status and Results Report,2025-04-19T14:55:06.000Z
Minimal Progress on Community Engagement Mechanisms for Refugee and Host Populations,"Facility Community Committees remain largely non-functional (only 1 of 18 assessed as operational), and annual regional/national health fora with adopted resolutions have not been completed. This undermines citizen engagement and grievance mechanisms for vulnerable populations including refugees.",medium,persistent,Primary health facilities with functional Facility Community Committee assessed by the PBF quality checklist (Number)... only 1 was assessed as 'functional/operational' by the PBF quality check list... Completion of annual regional and national health fora with adopted resolutions (Yes/No) No... 0.00 31-Dec-2024,c34b9799,P178033,Implementation Status and Results Report,2025-04-19T14:55:06.000Z
Political and Governance Risk Rated High at Project Approval,"The project faces a High political and governance risk rating, indicating significant concerns about the political environment and governance capacity in Djibouti that could affect implementation of public finance management reforms.",high,persistent,Political and Governance High High,842680bc,P180696,Implementation Status and Results Report,2025-04-17T20:50:13.000Z
Critical Implementation of Governance Structures for PFM Reform,"The project's effectiveness depends on implementation of a Decree and Order establishing governance structures for PFM reform. Fulfillment of these dated covenants is identified as the most critical challenge, suggesting potential governance fragility or institutional resistance to reform implementation.",high,new,"The main challenge remains the fulfillment of the dated covenants set out, the most critical of which is the implementation of the Decree and Order relating to the PFM Reform.",261b5867,P180696,Implementation Status and Results Report,2025-04-17T20:50:13.000Z
Inactive Project Steering Committee Affecting Governance,"The project steering committee for SKILLS has not yet become operational, creating a governance gap that may impede coordination between ministries and stakeholder engagement on project implementation.",medium,persistent,"Le comité de pilotage du projet Skills n'est pas encore actif, la mission est en discussion avec les institutions concernées sur une alternative définitive pour la mise en place d'un comité de pilotage du projet.",ca812012,P175483,Aide Memoire,2025-02-14T11:25:05.000Z
