risk_title,risk_summary,severity,direction,evidence_quote,realized_risk_id,PROJ_ID_IB,doc_type,doc_date
Political and Governance Risk Escalation,"Political and Governance risk rating has increased from Moderate at approval to Substantial at the last review, indicating worsening governance fragility or political instability affecting project implementation.",high,worsening,Political and Governance Moderate [at Approval Package - 26 May 2022] ... Substantial [Last Approved Rating ISR Seq. 06 - 19 Apr 2025] ... Substantial [Proposed Rating],4a799037,P178033,Implementation Status and Results Report,2025-10-22T21:20:14.000Z
Coordination and Planning Difficulties Affecting Service Delivery,"Continued difficulties with coordination, planning and outreach are impacting immunization service delivery and data quality, suggesting governance or institutional coordination challenges affecting project implementation.",medium,persistent,"Poor quality of immunization registered filling. Continued difficulties with coordination, planning and outreach.",6d1f5ef9,P178033,Implementation Status and Results Report,2025-10-22T21:20:14.000Z
Refugee Data Collection and Service Delivery Gaps,"Disaggregated data for refugee populations is not available or incomplete across multiple health indicators, indicating potential access barriers or governance challenges in serving refugee populations as a priority project target group.",medium,persistent,Disaggregated data is still not available and will be provided in the next ISR [for refugees receiving immunization services],0d2db5e2,P178033,Implementation Status and Results Report,2025-10-22T21:20:14.000Z
Delayed adoption of Digital Code hampering project implementation,"The non-adoption of the Digital Code (Code du Numérique), particularly Book Two covering telecommunications regulation, is causing delays in multiple project activities across both DFN and EARDIP. This legislative gap is blocking the operationalization of key regulatory frameworks needed for project success.",high,persistent,"Le Code du Numérique n'est toujours pas adopté. Cette situation entraîne le retard de plusieurs activités qui en dépendent... La mission réitère sa recommandation au Gouvernement de prendre les mesures nécessaires afin d'adopter rapidement le Code du Numérique ou le cas échéant, son livre deuxième portant le cadre légal et règlementaire du secteur des télécommunications",c8c2b2b2,P174461,Aide Memoire,2025-10-06T15:05:03.000Z
Governance fragility affecting regulatory capacity,The ARMD (regulatory authority) lacks its primary operational tool—the Digital Code Book Two—which is essential for regulating the telecommunications sector. This creates a governance gap that undermines the authority's ability to function effectively and implement project activities.,high,persistent,"le livre deuxième du code du numérique portant le secteur des télécommunications, qui constitue son principal outil de travail pour réguler le secteur, n'a pas encore été adopté",b16e9d35,P174461,Aide Memoire,2025-10-06T15:05:03.000Z
Institutional capacity constraints in project management units,"Both projects face implementation delays linked to weak institutional capacity. The DFN Component 2 is rated Modérément Insatisfaisante (Moderately Unsatisfactory) due to activity implementation delays, and EARDIP procurement execution remains slow despite project effectiveness.",medium,persistent,"La performance de la composante 2 est maintenue à Modérément Insatisfaisante (MU) en raison des retards dans la mise en œuvre des activités... pour le projet d'Intégration Numérique Régionale en Afrique de l'Est, il est toujours noté que le démarrage de la passation des marchés reste lent",c9613808,P174461,Aide Memoire,2025-10-06T15:05:03.000Z
Delays in environmental and social safeguards implementation for EARDIP,"EARDIP faces significant delays in environmental and social (E&S) reporting and grievance mechanisms. Required quarterly E&S reports for Q1 and Q2 2024 were not submitted by their deadlines (October 2024 and January 2025), and the Grievance Redress Mechanism (GRM) has not been operationalized, creating governance and accountability gaps.",medium,worsening,"Le premier rapport de suivi E&S (et la manière de traiter les incidents EAS/HS), conformément à l'EARDIP, n'a pas été soumis. Il devait être présenté en octobre 2024... Le deuxième rapport devait être présenté en janvier 2025... la Banque exige les deux rapports pour la fin du mois de mars au plus tard",7b00fc2e,P174461,Aide Memoire,2025-10-06T15:05:03.000Z
Weak grievance mechanisms and stakeholder engagement in both projects,"Both DFN and EARDIP have inadequate grievance redress mechanisms (GRM). For EARDIP, it is unclear how EARDIP-specific grievances will be identified and addressed. For DFN, the GRM is not operationalized, with complaint channels not displayed on websites, work sites, or communicated to stakeholders during public consultations.",medium,persistent,"Bien que l'équipe déclare disposer d'un MGP pour le projet national, il convient de clarifier la manière dont les griefs liés à l'EARDIP seront abordés et identifiés... La mission recommande aussi de rendre le MGP plus opérationnelles en affichant les canaux de réceptions des plaintes dans le site web du Ministère, les locaux de l'UGP, les sites de travaux",85f1adf3,P174461,Aide Memoire,2025-10-06T15:05:03.000Z
Refugee enrollment and completion tracking gaps,"The project targets refugees as a key vulnerable group but has zero reported enrollment and completion data for refugees across multiple indicators, with comments indicating data is 'currently not available.' This represents a significant implementation gap for a core FCV-vulnerable population.",high,persistent,Increased enrollment in selected TVET areas - Refugees (Number) 220.00 0 0 800.00... Share of trainees completing TVET programs increased - Refugees (Percentage) Comments on achieving targets This data is currently not available but will be gathered before the next ISR.,25f557a9,P175483,Implementation Status and Results Report,2025-09-04T21:37:09.000Z
Persons with disabilities exclusion from training programs,"Despite targeting persons with disabilities as a vulnerable group, zero individuals with disabilities have been enrolled or completed training programs across multiple indicators, suggesting systemic barriers to inclusion of this FCV-vulnerable population.",high,persistent,Increased enrollment in selected TVET areas - Persons with disabilities (Number) 47.00 0 0 160.00... Share of trainees completing TVET programs increased - Persons with disabilities (Percentage) Comments on achieving targets This data is currently not available but will be gathered before the next ISR.,6ab38f65,P175483,Implementation Status and Results Report,2025-09-04T21:37:09.000Z
Refugee participation in work-based learning and apprenticeships stalled,"Zero refugees have been engaged in apprenticeships, internships, OJT and work-based learning despite a target of 180, indicating potential displacement or refugee population access barriers to employment integration activities.",medium,persistent,"Number and share of students engaged in Apprenticeships, Internships, OJT and WBL - Refugees (Number) 0.00 0.00 0.00 180.00",306803cc,P175483,Implementation Status and Results Report,2025-09-04T21:37:09.000Z
Labor mobility agreements not advancing amid regional tensions,"Zero bilateral labor agreements have been signed despite a target of 6, and zero short-term migrant workers have been deployed despite a target of 250. This suggests potential governance or regional political barriers to labor mobility initiatives.",medium,persistent,IRI # 4: Number of Bilateral Labor Agreements signed (Number)... 0.00 Sep/2021 0 09-Jan-2025 0 12-Aug-2025 6.00 Sep/2027... IRI # 5: Annual number of short-term migrant workers from Djibouti... 0.00 Sep/2021 0 09-Jan-2025 0 12-Aug-2025 250.00 Sep/2026,89777823,P175483,Implementation Status and Results Report,2025-09-04T21:37:09.000Z
Online gig work initiative abandoned due to coordination constraints,"The online gig work indicator targeting 500 individuals is being deleted during restructuring due to 'significant delays' and 'technical constraints and coordination with implementing partners,' suggesting governance or institutional coordination failures affecting vulnerable populations.",medium,worsening,"IRI # 3: Number of individuals engaged in Online Gig Work... During the upcoming restructuring, this indicator will be deleted due to significant delays in the implementation of the corresponding activity. As of the mid-term review, no concrete action had yet been taken, partly due to technical constraints and coordination with implementing partners.",bf87e79a,P175483,Implementation Status and Results Report,2025-09-04T21:37:09.000Z
Refugee and Asylum Seeker Data Collection Challenges,"The project is collecting data on refugees and asylum seekers through the Population and Housing Census (RGPH-3) and the fifth household budget survey (EDAM5-IS), which included a boosted sample of migrant and refugee households. This suggests underlying displacement pressures and refugee populations that may create implementation complexities and data collection risks in a fragile context.",medium,persistent,"Provisional results of thematic analyses including...Refugees and asylum seekers (Volume 14)...were released between April and July 2025. Between January and February 2025, INSTAD conducted the fifth household budget survey (Enquete Djiboutienne Aupres des Menages pour les Indicateurs Sociaux, EDAM5-IS), which included a boosted sample of migrant and refugee households.",bb264b38,P171777,Implementation Status and Results Report,2025-08-07T17:45:23.000Z
Political and Governance Risk Persistence,"The Political and Governance risk rating has remained at 'Substantial' across all review periods (Approval, Last Approved, and Current), indicating persistent governance fragility that could affect project implementation, particularly for institutional capacity building and coordination with government entities.",high,persistent,"Political and Governance: Substantial (Rating at Approval: Substantial, Last Approved Rating ISR Seq. 09 - 04 Feb 2025: Substantial, Proposed Rating: Substantial)",f8088c15,P171777,Implementation Status and Results Report,2025-08-07T17:45:23.000Z
Institutional Capacity and Staffing Constraints Affecting Macroeconomic Planning,"Progress on macroeconomic modeling and debt strategy development has been slowed by staffing constraints, limiting the government's ability to implement key fiscal planning tools. This institutional weakness affects coordination between development actors and government capacity to absorb technical assistance.",medium,persistent,"However, progress has been slowed by staffing constraints. To sustain momentum, a follow-up World Bank mission is planned before December 2025 to support the formulation of a Medium-Term Debt Strategy, key to embedding fiscal planning within a more structured macroeconomic framework.",a5a3ce88,P171777,Implementation Status and Results Report,2025-08-07T17:45:23.000Z
Refugee and Asylum Seeker Data Collection Challenges,The project is collecting data on refugees and asylum seekers through the Population and Housing Census (RGPH-3) and the fifth household budget survey (EDAM5-IS) with a boosted sample of migrant and refugee households. This suggests underlying displacement pressures and refugee populations that may create implementation complexities and data access challenges in a fragile context.,medium,persistent,"Provisional results of thematic analyses including...Refugees and asylum seekers (Volume 14)...were released between April and July 2025. Between January and February 2025, INSTAD conducted the fifth household budget survey (Enquete Djiboutienne Aupres des Menages pour les Indicateurs Sociaux, EDAM5-IS), which included a boosted sample of migrant and refugee households.",20150d33,P171777,Implementation Status and Results Report,2025-08-07T17:45:16.000Z
Staffing Constraints Affecting Macroeconomic Planning Capacity,"Progress on developing the Medium-Term Debt Strategy (MTDS) has been slowed by staffing constraints, limiting the government's capacity to embed fiscal planning within macroeconomic frameworks. This institutional capacity gap may reflect broader governance fragility affecting project implementation.",medium,persistent,"However, progress has been slowed by staffing constraints. To sustain momentum, a follow-up World Bank mission is planned before December 2025 to support the formulation of a Medium-Term Debt Strategy, key to embedding fiscal planning within a more structured macroeconomic framework.",c6b3a700,P171777,Implementation Status and Results Report,2025-08-07T17:45:16.000Z
Fragmentation in Aid Coordination Mechanisms,Longstanding fragmentation in aid coordination has necessitated a consultant review to redesign Djibouti's development cooperation framework. This fragmentation suggests tensions or coordination failures between government and development actors that may affect project implementation.,medium,persistent,"To address longstanding fragmentation in aid coordination, a consultant was hired in February 2025 to review and redesign Djibouti's framework for development cooperation.",bd507e55,P171777,Implementation Status and Results Report,2025-08-07T17:45:16.000Z
Drought Declaration Triggering Project Suspension and Restructuring,"Government declared a drought situation in June 2025 that prompted suspension of the project's main activities and an official restructuring request to the World Bank, disrupting implementation timelines and requiring reallocation of resources.",high,new,"the government declared, in June 2025, a drought situation that prompted an official request to the Bank for project restructuring and also resulted in the suspension of the project's main activities",558abcac,P178988,Implementation Status and Results Report,2025-08-04T20:00:07.000Z
Incomplete Water Infrastructure Rehabilitation Pending Handover,"Rehabilitation work on 11 of 25 targeted water infrastructure facilities is complete but pending official handover, with the restructuring proposal discontinuing rehabilitation of the remaining 26 water infrastructures, creating implementation gaps in drought response capacity.",medium,worsening,"completing rehabilitation work on 11 of the 25 targeted water infrastructure facilities, now pending official handover; and...it recommends discontinuing certain activities—such as rehabilitation of the remaining 26 water infrastructures",ecd2a873,P178988,Implementation Status and Results Report,2025-08-04T20:00:07.000Z
Reallocation of Food Security Resources Due to Drought Emergency,"The restructuring proposal reallocates SDR 3,925,000 from the Food Shortage Preparedness Fund to the Emergency Food Stock component to address the declared drought, reducing preparedness capacity for food supply shocks.",medium,new,"The restructuring request proposes, under Component 1, doubling the strategic food reserve by reallocating SDR 3,925,000 from the Food Shortage Preparedness Fund sub-component to the Emergency Food Stock one",5c915f6a,P178988,Implementation Status and Results Report,2025-08-04T20:00:07.000Z
Governance and Institutional Coordination Gaps Affecting Project Safety Implementation,"Delays and lack of cooperation from ONEAD (public utility company) in coordinating service adjustments are hindering project progress and creating safety risks. Open trenches remain unresolved due to institutional coordination failures, exposing workers and road users to serious accident risks.",high,persistent,L'entrepreneur a exprimé ses préoccupations concernant le manque de coopération de l'ONEAD et a demandé le soutien de l'ADR pour accélérer le processus. Ces tranchées ouvertes représentent un risque pour la sécurité.,6a6d7184,P174300,Aide Memoire,2025-07-16T05:25:05.000Z
Weak Government Oversight and Non-Compliance with Environmental and Social Standards,"Government quarterly reports lack detail on non-conformities observed in the field, indicating weak monitoring capacity or willingness to report implementation failures. Critical safety and labor violations were not documented in official reports despite being evident during field visits.",high,persistent,"Le gouvernement a partagé avec la mission le rapport trimestriel dans les délais, cependant celui-ci manquait de détails concernant les non-conformités observées sur le terrain, lesquelles n'ont pas été signalées dans le document.",6b82011d,P174300,Aide Memoire,2025-07-16T05:25:05.000Z
Systemic Labor Rights and Social Protection Violations on Project Sites,"150 daily laborers lack proper employment contracts, social security registration, and face deplorable working conditions including excessive heat exposure without adequate shelter. Accident records show significant inconsistencies, indicating weak labor governance and worker protection mechanisms.",high,persistent,"les contrats des 150 journaliers ne sont pas conformes (absence de cachets officiels, copies non remises aux employés), plusieurs travailleurs ne possèdent pas de carte de la Caisse Nationale de Sécurité Sociale (CNSS), et des incohérences significatives apparaissent dans les registres d'accidents. Les conditions des travailleurs sont également déplorables, étant exposés à la chaleur excessive sans abris adéquats",d5bb6440,P174300,Aide Memoire,2025-07-16T05:25:05.000Z
Critical Safety and Security Failures in Project Implementation,"Multiple critical safety violations identified during April 2025 site visit: absence of dedicated HSE agents, unsecured trenches, inadequate separation between machinery and vulnerable road users, and inadequate nighttime signaling. These failures expose workers, road users, and surrounding communities to serious accident risks.",high,persistent,"la mission a constaté l'absence d'agents Hygiène Sécurité Environnement (HSE) dédiés, de nombreuses tranchées non sécurisées, une séparation insuffisante entre les engins et personnes vulnérables utilisant la route dont les piétons, et une signalisation nocturne inadéquate dans les zones de rétrécissement. Ces manquements exposent les travailleurs, les usagers et les communautés riveraines à des risques graves d'accidents.",791b0cd4,P174300,Aide Memoire,2025-07-16T05:25:05.000Z
High Road Safety Risks on Project Corridor,The corridor experiences a high number of road accidents. Thirteen traffic incidents unrelated to work zones have been reported since project start. The mission emphasized the importance of respecting road safety standards and strengthening signaling on the corridor to reduce accident risks.,high,persistent,"Prenant en compte le nombre élevé d'accidents de routes sur le corridor, ainsi que les recommandations suite à la visite de terrain, la mission a souligné l'importance du respect des normes de sécurité routière sur les tronçons inclus dans le cadre du projet.",6255e9d7,P174300,Aide Memoire,2025-07-16T05:25:05.000Z
Inadequate Data Accuracy and Monitoring of Safety Incidents,"Road accident data reported for the corridor (PK 13 to Arta) are inaccurate, including incorrect geographic positioning. This undermines the project's ability to track and respond to safety risks effectively, indicating weak monitoring and data management systems.",medium,persistent,"les rapports des données sur les accidents du corridor sud (de PK 13 à Arta) ne sont pas exacts. Une visite de terrain a été effectuée avec l'équipe de suivi des incidents et l'entreprise pour utiliser Kobo Toolbox, renseigner les informations reportées et corriger les données sur la sécurité routière, notamment en ce qui concerne la position géographique.",704ad934,P174300,Aide Memoire,2025-07-16T05:25:05.000Z
Persistent Political and Governance Fragility Affecting Implementation,"Political and governance risks remain at Substantial level across all rating periods, indicating ongoing fragility that could impede project implementation, particularly for cross-border coordination and institutional capacity building required for the corridor project.",high,persistent,"Political and Governance Substantial Substantial Substantial [Risk Category Rating at Approval, Last Approved Rating, Proposed Rating]",60501546,P174300,Implementation Status and Results Report,2025-07-15T19:35:07.000Z
Stakeholder Engagement Challenges at Substantial Risk Level,"Stakeholder risks remain rated as Substantial across all assessment periods, suggesting ongoing tensions or coordination challenges with government, development actors, or communities that could affect project delivery along the Djibouti-Addis corridor.",high,persistent,"Stakeholders Substantial Substantial Substantial [Risk Category Rating at Approval, Last Approved Rating, Proposed Rating]",6eed4760,P174300,Implementation Status and Results Report,2025-07-15T19:35:07.000Z
Refugee Student Integration and Retention Challenges,"Refugee enrollment in primary education shows declining trend and low absolute numbers, with only 2,403 cumulative refugee enrollments against a target of 37,000 out-of-school children. School year 2024-2025 saw only 384 refugee enrollments (pending verification), representing a significant drop from previous years, suggesting potential barriers to refugee access and retention in the education system.",medium,worsening,"*Refugees: 2,403 (pending verification)- cummulative 2020-2021 =496 2021-2022=596 2022-2023=425 2023-2024=502 2024-2025= 384 (pending verification)",0d128e2f,P166059,Implementation Status and Results Report,2025-07-13T10:25:11.000Z
Limited Adoption of EMIS by Private Arabic Schools,"Private Arabic schools have not yet adopted the government's Education Management Information System (GOSE), creating a parallel system and potential governance fragmentation. This exclusion may reflect tensions between government education priorities and private/religious education providers, limiting government visibility and management capacity over a segment of the education system.",medium,persistent,"All public schools and French private schools are now using GOSE, while private Arabic schools have not yet adopted the system.",231a1515,P166059,Implementation Status and Results Report,2025-07-13T10:25:11.000Z
Incomplete School Management Committee Functionality,"Only 62% of School Management Committees are currently functional, indicating weak local governance structures and limited community participation in school oversight. This governance gap may undermine project sustainability and create space for informal power dynamics or exclusion of vulnerable populations from school decision-making.",medium,persistent,"According to the recent DGS report, 62% of primary and middle schools currently have functional management committees.",0ea9a281,P166059,Implementation Status and Results Report,2025-07-13T10:25:11.000Z
Difficult road accessibility in rural regions impacting project implementation,"Poor road infrastructure and seasonal conditions in remote rural areas are causing logistical delays in the distribution of in-kind transfers and limiting access for implementation teams, particularly during rainy seasons.",medium,persistent,"les conditions routières difficiles, particulièrement pendant la saison des pluies, rend certaines localités difficiles d'accès pour les équipes de distribution et les transporteurs, ce qui a occasionné des retards logistiques dans la livraison des vivres",32c7e618,P508560,Aide Memoire,2025-07-11T06:35:05.000Z
Limited economic viability and market access in remote localities,"Rural communities face constraints in identifying viable income-generating activities due to weak market access and limited economic diversification, affecting the sustainability of productive inclusion activities (CREC and AGR).",medium,persistent,"Dans certaines localités reculées, il est également difficile d'identifier des activités génératrices de revenus viables, en raison du faible accès aux marchés et du manque de diversification économique",792321f6,P508560,Aide Memoire,2025-07-11T06:35:05.000Z
Weak community grievance mechanism affecting beneficiary concerns,"The current complaint management mechanism has weaknesses that limit effective and timely response to beneficiary concerns, potentially affecting project credibility and community trust.",medium,persistent,La mission estime que le fonctionnement du mécanisme de gestion des plaintes actuel présente des faiblesses et recommande de l'améliorer pour garantir une réponse efficace et rapide aux préoccupations des bénéficiaires,d92431d6,P508560,Aide Memoire,2025-07-11T06:35:05.000Z
Inadequate stakeholder mobilization and beneficiary participation,Weak documentation of stakeholder mobilization and limited beneficiary participation are affecting project implementation and community engagement.,medium,persistent,la faible documentation des mobilisations de parties prenantes et le faible fonctionnement de MGP,24988387,P508560,Aide Memoire,2025-07-11T06:35:05.000Z
Risk of unequal access and unfair treatment in youth training programs,"Youth training programs targeting 400 beneficiaries in interior regions carry risks of unequal opportunity and inequitable treatment, particularly for vulnerable populations, requiring proactive risk management.",medium,new,"La mission recommande vivement que les risques associés à ces formations soient traités de manière proactive pour garantir l'égalité de chances et le traitement équitable, tout en tenant compte du public vulnérable",0a01d2e2,P508560,Aide Memoire,2025-07-11T06:35:05.000Z
