risk_title,risk_summary,severity,direction,evidence_quote,realized_risk_id,PROJ_ID_IB,doc_type,doc_date
Resettlement delays affecting project implementation in slum areas,"Project investments in four slums are pending due to remaining resettlements that have not been completed, causing delays in construction and upgrading activities.",medium,persistent,"Two other investments (CDC and sports field) have started, while others are pending due to a few remaining resettlements.",703474ae,P162901,Implementation Status and Results Report,2025-05-25T20:51:42.000Z
Institutional capacity constraints at Land Directorate blocking land regularization,"Land regularization files have been blocked since October 2023 due to the Land Directorate's prioritization of data migration, directly impacting the project's land certificate delivery targets and affecting host communities and refugees seeking property access.",medium,persistent,"Progress has been slow and the files have been blocked by the Land Directorat since October, 2023 due to the priority it has given to the migration of INFOCAD data to the ArcGIS software.",45e2d0fe,P162901,Implementation Status and Results Report,2025-05-25T20:51:42.000Z
"Refugee village restructuring plans pending approval, delaying refugee-focused investments","Construction in refugee villages (Ali Addeh and Holl Holl) is delayed as restructuring plans are under validation and awaiting approval, affecting property access certificates and socioeconomic integration activities for refugees.",medium,persistent,"Meanwhile, the program for investments in refugee villages is under validation, with construction expected to start in the spring.",ad3a752a,P162901,Implementation Status and Results Report,2025-05-25T20:51:42.000Z
Zero implementation of refugee-led CSO sub-projects despite targets,"No refugee-led CSO sub-projects have been implemented (0 out of 60 target), indicating potential governance or institutional barriers to refugee economic integration and participation in project activities.",medium,persistent,SEDF-funded sub-projects implemented by refugee-led CSO (Number) 0.00 Oct/2019 0.00 31-Oct-2023 0.00 31-Oct-2023 60.00 Dec/2026,22da437e,P162901,Implementation Status and Results Report,2025-05-25T20:51:42.000Z
No progress on training civil servants to implement National Refugee Law,"Zero civil servants and civil society members have been trained on the 2017 National Refugee Law implementation despite a target of 100, indicating governance capacity gaps in refugee policy operationalization.",medium,persistent,"National and local civil servants, and civil society members that were trained to foster the implementation of the 2017 Refugee Law (Number) 0.00 Sep/2020 0.00 15-May-2024 0.00 15-May-2024 100.00 Dec/2025",6bf4237b,P162901,Implementation Status and Results Report,2025-05-25T20:51:42.000Z
No implementation of sectoral action plan recommendations for refugee law operationalization,"Despite five sectoral action plans being prepared for the National Refugee Law, zero recommendations have been implemented as of May 2024, indicating governance and institutional implementation gaps.",medium,persistent,Recommendations resulting from the sectoral action plans that have been implemented (Number) 0.00 Sep/2020 0.00 15-May-2024 0.00 15-May-2024 6.00 Dec/2025,0589f50b,P162901,Implementation Status and Results Report,2025-05-25T20:51:42.000Z
